Organization Name,Organization Name URL,Categories,CB Rank (Company),Number of Articles,Estimated Revenue Range,Number of Investments,Number of Lead Investments,Number of Exits,Number of Exits (IPO),Accelerator Program Type,Accelerator Duration (in weeks),Number of Alumni,Number of Enrollments,School Type,School Program,School Method,Number of Founders (Alumni),Headquarters Location,Number of Founders,Number of Employees,Founders,Number of Funding Rounds,Total Equity Funding Amount,Total Equity Funding Amount Currency,Total Equity Funding Amount Currency (in USD),Funding Status,Last Funding Date,Last Funding Amount,Last Funding Amount Currency,Last Funding Amount Currency (in USD),Last Funding Type,Last Equity Funding Amount,Last Equity Funding Amount Currency,Last Equity Funding Amount Currency (in USD),Last Equity Funding Type,Total Funding Amount,Total Funding Amount Currency,Total Funding Amount Currency (in USD),Top 5 Investors,Number of Lead Investors,Number of Investors,Number of Acquisitions,Acquisition Status,Transaction Name,Transaction Name URL,Acquired by,Acquired by URL,Announced Date,Announced Date Precision,Price,Price Currency,Price Currency (in USD),Acquisition Type,Acquisition Terms,IPO Status,IPO Date,Delisted Date,Delisted Date Precision,Money Raised at IPO,Money Raised at IPO Currency,Money Raised at IPO Currency (in USD),Valuation at IPO,Valuation at IPO Currency,Valuation at IPO Currency (in USD),Stock Symbol,Stock Symbol URL,Stock Exchange,Number of Events,CB Rank (Organization),CB Rank (School),Trend Score (7 Days),Trend Score (30 Days),Trend Score (90 Days),SimilarWeb - Monthly Visits,SimilarWeb - Average Visits (6 months),SimilarWeb - Monthly Visits Growth,SimilarWeb - Visit Duration,SimilarWeb - Visit Duration Growth,SimilarWeb - Page Views / Visit,SimilarWeb - Page Views / Visit Growth,SimilarWeb - Bounce Rate,SimilarWeb - Bounce Rate Growth,SimilarWeb - Global Traffic Rank,SimilarWeb - Monthly Rank Change (#),SimilarWeb - Monthly Rank Growth,BuiltWith - Active Tech Count,Apptopia - Number of Apps,Apptopia - Downloads Last 30 Days,Siftery - Total Products Active,IPqwery - Patents Granted,IPqwery - Trademarks Registered,IPqwery - Most Popular Patent Class,IPqwery - Most Popular Trademark Class,Aberdeen - IT Spend,Aberdeen - IT Spend Currency,Aberdeen - IT Spend Currency (in USD),Founded Date,Founded Date Precision,Exit Date,Exit Date Precision,Company Type,Investor Type,Investment Stage,Number of Portfolio Organizations,Accelerator Application Deadline,Category Groups
Hutchison Telecommunications Technology Investments Ltd.,https://www.crunchbase.com/organization/hutchison-telecommunications-technology-investments,"Information Technology, Telecommunications","623,925",,,,,,,,,,,,,,,"Hong Kong, Hong Kong Island, Hong Kong",,,,,,,,M&A,,,,,,,,,,,,,,,,,Was Acquired,Hutchison Telecommunications Technology Investments Ltd. acquired by PCCW,https://www.crunchbase.com/acquisition/pccw-acquires-hutchison-telecommunications-technology-investments--4f8e0b26,PCCW,https://www.crunchbase.com/organization/pccw,2001-02-22,day,103000000,USD,103000000,Acquisition,,Private,,,,,,,,,,,,,,"667,683",,0.6,0.1,0.8,,,,,,,,,,,,,,,,,,,,,,,,,,2001-02-22,day,For Profit,,,,,"Hardware, Information Technology"
SinoSheen Internet Investments,https://www.crunchbase.com/organization/sinosheen-internet-investments,"Finance, Information Technology, Venture Capital","420,407",,,,,,,,,,,,,,,"Hong Kong, Hong Kong Island, Hong Kong",2,11-50,"O.D. Kobo, Roman Abramovich",1,6000000,USD,6000000,M&A,2002-06-01,6000000,USD,6000000,Angel,6000000,USD,6000000,Angel,6000000,USD,6000000,O.D. Kobo,1,1,,Was Acquired,SinoSheen Internet Investments acquired by Fidelity,https://www.crunchbase.com/acquisition/fidelity-investments-acquires-sinosheen-internet-investments--91d51ecd,Fidelity,https://www.crunchbase.com/organization/fidelity-investments,2006-04-01,month,52500000,USD,52500000,Acquisition,,Private,,,,,,,,,,,,,,"450,914",,-0.1,0,-0.2,,,,,,,,,,,,,,,,,,,,,,,,1998-06-01,month,2006-04-01,month,For Profit,,,,,"Financial Services, Information Technology, Lending and Investments"
m-FINANCE Limited,https://www.crunchbase.com/organization/m-finance-limited,"Information Services, Information Technology","245,781",,,,,,,,,,,,,,,"Sheung Wan, Hong Kong Island, Hong Kong",,101-250,,,,,,M&A,,,,,,,,,,,,,,,,,Was Acquired,m-FINANCE Limited acquired by DTXS Silk Road Investment Holdings Co Ltd.,https://www.crunchbase.com/acquisition/dtxs-silk-road-investment-holdings-co-ltd-acquires-m-finance-limited--6ac7f973,DTXS Silk Road Investment Holdings Co Ltd.,https://www.crunchbase.com/organization/dtxs-silk-road-investment-holdings-co-ltd,2016-07-23,day,40800000,USD,40800000,Acquisition,,Private,,,,,,,,,,,,,,"265,188",,0.1,0,-0.3,"3,843","1,101.35",114.79%,2,-73.88%,1.86,-12.26%,19.45%,0.4%,"6,292,528","-3,247,090",-34.04%,2,19,476,,,,,,,,,2002-01-01,year,2016-07-23,day,For Profit,,,,,Information Technology
ICG,https://www.crunchbase.com/organization/i-consulting-group,"Enterprise, Information Services, Information Technology","152,805",,,,,,,,,,,,,,,"Kwai Tsing, New Territories, Hong Kong",,51-100,,,,,,M&A,,,,,,,,,,,,,,,,,Was Acquired,ICG acquired by Hong Kong Broadband Network,https://www.crunchbase.com/acquisition/hong-kong-broadband-network-acquires-i-consulting-group--49618132,Hong Kong Broadband Network,https://www.crunchbase.com/organization/hong-kong-broadband-network,2018-05-30,day,200000000,HKD,25487934,Acquisition,,Private,,,,,,,,,,,,,,"164,150",,0.2,0.9,2.5,"2,724","1,905.8",30.29%,248,85.04%,2.29,-1.54%,28.65%,-10.57%,"6,521,557","-1,223,501",-15.8%,22,,,,,,,,,,,2003-01-01,month,2018-05-30,day,For Profit,,,,,Information Technology
cherrypicks alpha,https://www.crunchbase.com/organization/cherrypicks-alpha,Information Technology,"290,936",,,,,,,,,,,,,,,"Kowloon City, Kowloon, Hong Kong",,11-50,,,,,,M&A,,,,,,,,,,,,,,,,,Was Acquired,cherrypicks alpha acquired by NetDragon Websoft,https://www.crunchbase.com/acquisition/netdragon-websoft-acquires-cherrypicks-alpha--5ba31557,NetDragon Websoft,https://www.crunchbase.com/organization/netdragon-websoft,2016-04-25,day,6000000,USD,6000000,Acquisition,Cash,Private,,,,,,,,,,,,,,"313,485",,-0.2,0,-0.3,,,,,,,,,,,,,10,,,,,,,,,,,2014-01-01,year,2016-04-25,day,For Profit,,,,,Information Technology
Alibaba Health Information Technology,https://www.crunchbase.com/organization/alibaba-health-information-technology,"Information Technology, Wellness, Wireless","4,049",18,,2,2,,,,,,,,,,,"Causeway Bay, Hong Kong Island, Hong Kong",,251-500,,1,290000000,USD,290000000,IPO,2019-05-24,290000000,USD,290000000,Post-IPO Equity,290000000,USD,290000000,Post-IPO Equity,290000000,USD,290000000,"Alibaba Group, Ant Financial",2,2,,,,,,,,,,,,,,Public,1996-05-01,,,,,,,,,0241,https://www.crunchbase.com/ipo/alibaba-health-information-technology-ipo--e29259e8,HKG,,"4,228",,-0.9,-1.1,9.6,"266,457","121,397.76",272.82%,151,606.85%,1.38,-16.38%,42.13%,16.8%,"321,856","-394,493",-55.07%,8,,"23,327",,,,,,,,,1998-01-01,year,1996-05-01,day,For Profit,Venture Capital,,2,,"Hardware, Health Care, Information Technology, Mobile"
Know Your Customer,https://www.crunchbase.com/organization/know-your-customer,"Compliance, FinTech, Information Technology, SaaS, Software","7,867",9,$1M to $10M,,,,,,,,,,,,,"Causeway Bay, Hong Kong Island, Hong Kong",3,11-50,"Claus Christensen, Cormac Doddy, Richard Barrett",2,3948259,USD,3948259,Seed,2019-04-30,1000000,USD,1000000,Seed,1000000,USD,1000000,Seed,3948259,USD,3948259,CLSA,1,1,,,,,,,,,,,,,,Private,,,,,,,,,,,,,9,"8,144",,-1.5,-2.3,4.9,"7,470","8,613.83",-10.4%,507,7.58%,5.34,27.03%,24.77%,1.91%,"2,420,994","-11,091",-0.46%,49,,,,,,,,,,,2015-09-29,day,,,For Profit,,,,,"Financial Services, Information Technology, Professional Services, Software"
Banuba,https://www.crunchbase.com/organization/banuba,"Artificial Intelligence, Augmented Reality, Information Technology, Machine Learning","8,491",3,,,,,,,,,,,,,,"Hong Kong, Hong Kong Island, Hong Kong",1,11-50,Viktor Prokopenya,2,12000000,USD,12000000,,2018-11-26,7000000,USD,7000000,Venture - Series Unknown,7000000,USD,7000000,Venture - Series Unknown,12000000,USD,12000000,"Larnabel Ventures, VP Capital",2,2,,,,,,,,,,,,,,Private,,,,,,,,,,,,,1,"8,785",,0.3,0,-0.4,"40,365","21,178.36",150.98%,40,26.23%,1.33,3.96%,58.67%,0.16%,"1,229,614","-1,059,854",-46.29%,31,18,"775,533",19,8,2,Computing; Calculating,Scientific and electric apparatus and instruments,,,,2016-06-01,month,,,For Profit,,,,,"Artificial Intelligence, Data and Analytics, Hardware, Information Technology, Science and Engineering, Software"
Crypto.com,https://www.crunchbase.com/organization/monaco-technology-gmbh,"Bitcoin, Blockchain, Cryptocurrency, Ethereum, Financial Services, FinTech, Information Technology, Mobile Payments","10,756",23,,,,,,,,,,,,,,"Sai Wan, Hong Kong Island, Hong Kong",2,101-250,"Kris Marszalek, Rafael Melo",1,2000000,USD,2000000,,2017-05-18,2000000,USD,2000000,Initial Coin Offering,2000000,USD,2000000,Initial Coin Offering,2000000,USD,2000000,,,,1,Made Acquisitions,,,,,,,,,,,,Private,,,,,,,,,,,,,6,"11,112",,0.6,0.9,-0.7,"733,081","497,038.05",45.83%,136,12.37%,2.46,10.76%,55.27%,-2.18%,"90,761","-31,537",-25.79%,22,,,10,,,,,,,,2016-06-01,month,,,For Profit,,,,,"Financial Services, Information Technology, Mobile, Payments, Software"
AERGO,https://www.crunchbase.com/organization/aergo-e080,"Blockchain, Cryptocurrency, Information Technology","10,894",,,,,,,,,,,,,,,"Wan Chai, Hong Kong Island, Hong Kong",2,101-250,"Phil Zamani, Won-Beom Kim",1,30000000,USD,30000000,,2018-11-16,30000000,USD,30000000,Venture - Series Unknown,30000000,USD,30000000,Venture - Series Unknown,30000000,USD,30000000,"Dekrypt Capital, JRR Crypto, NEO Global Capital (NGC), Rockaway Capital, Sequoia Capital China",1,10,,,,,,,,,,,,,,Private,,,,,,,,,,,,,,"11,251",,-0.2,-0.2,-0.4,"8,194","21,043.09",-67.12%,81,-30.6%,2.3,-7.69%,46.36%,13.78%,"2,910,741","1,631,627",127.56%,18,,,,,,,,,,,2018-01-01,year,,,Non-profit,,,,,"Financial Services, Information Technology, Payments, Software"
CyberMiles,https://www.crunchbase.com/organization/cybermiles,"Blockchain, E-Commerce Platforms, Information Technology, Internet","17,239",1,,1,,,,,,,,,,,,"Central, Hong Kong Island, Hong Kong",2,11-50,"Liang Lu, Michael Yuan",1,30000000,USD,30000000,,2017-11-22,30000000,USD,30000000,Initial Coin Offering,30000000,USD,30000000,Initial Coin Offering,30000000,USD,30000000,,,,,,,,,,,,,,,,,Private,,,,,,,,,,,,,1,"17,765",,0.5,2.1,3.5,"17,004","24,959.19",-19.85%,109,101.46%,2.98,26.51%,37.52%,14.04%,"1,526,412","45,885",3.1%,33,,,,,,,,,,,2017-01-01,year,,,For Profit,,,1,,"Commerce and Shopping, Information Technology, Internet Services"
Pulse iD,https://www.crunchbase.com/organization/pulse-id,Information Technology,"18,602",1,,,,,,,,,,,,,,"Quarry Bay, Hong Kong Island, Hong Kong",2,11-50,"Alex Topaloski, Shak Tiwari",1,3800000,USD,3800000,Early Stage Venture,2017-04-11,3800000,USD,3800000,Series A,3800000,USD,3800000,Series A,3800000,USD,3800000,"Digital Ventures, Investec, SCB Group, Tuas Capital Partners",1,4,,,,,,,,,,,,,,Private,,,,,,,,,,,,,1,"19,162",,-0.2,0.8,1.1,"1,125","3,410.09",-31.02%,178,-33.82%,4.65,28.75%,14.71%,-41.87%,"9,134,416","1,424,766",18.48%,29,,,16,,,,,,,,2016-01-01,year,,,For Profit,,,,,Information Technology
PressLogic,https://www.crunchbase.com/organization/presslogic,"Content Marketing, Digital Marketing, Digital Media, Information Technology, Lifestyle, Software","18,923",1,,,,,,,,,,,,,,"Kowloon City, Kowloon, Hong Kong",2,101-250,"Edward Chow, Ryan Cheung",1,10000000,USD,10000000,Early Stage Venture,2018-11-07,10000000,USD,10000000,Series A,10000000,USD,10000000,Series A,10000000,USD,10000000,Meitu,1,1,,,,,,,,,,,,,,Private,,,,,,,,,,,,,,"19,490",,0.2,-0.1,-0.3,"891,620","1,110,800.55",-14.17%,79,3.32%,1.96,-3.29%,52.25%,1.53%,"82,148","11,005",15.47%,28,,,,,,,,,,,2016-01-01,year,,,For Profit,,,,,"Community and Lifestyle, Information Technology, Media and Entertainment, Sales and Marketing, Software"
Pakpobox,https://www.crunchbase.com/organization/pakpobox-hong-kong-limited,"Cloud Computing, Information Technology, Internet of Things, Laundry and Dry-cleaning, Shopping","21,925",3,$1M to $10M,,,,,,,,,,,,,"New Territories, New Territories, Hong Kong",4,11-50,"Christian Secci, Eric Choi, Matthew Ng, Sheldon Li",2,2320000,USD,2320000,Seed,2018-11-26,1120000,USD,1120000,Seed,1120000,USD,1120000,Seed,2320000,USD,2320000,"Betatron, Infinity Ventures, SQ Capital Group, The Aria Group",1,4,,,,,,,,,,,,,,Private,,,,,,,,,,,,,,"22,582",,0.1,-0.2,-0.4,956,"1,319.55",-57.31%,59,,2.92,191.9%,54.84%,22.77%,"10,961,867","177,603",1.65%,13,,,,,,,,,,,2013-01-01,year,,,For Profit,,,,,"Clothing and Apparel, Commerce and Shopping, Information Technology, Internet Services, Software"
Shellanoo Group,https://www.crunchbase.com/organization/shellanoo-group,"Incubators, Information Technology","22,952",1,$10M to $50M,,,,,,,,,,,,,"Hong Kong, Hong Kong Island, Hong Kong",2,51-100,"Shai Azran, Uzi Refaeli",2,60000000,USD,60000000,Early Stage Venture,2015-03-01,55000000,USD,55000000,Series B,55000000,USD,55000000,Series B,60000000,USD,60000000,,,,,,,,,,,,,,,,,Private,,,,,,,,,,,,,,"23,643",,0,1.8,1.1,,,,,,,,,,,,,4,7,,,,,,,,,,2014-08-01,day,,,For Profit,,,,,"Financial Services, Information Technology, Lending and Investments"
Ybex,https://www.crunchbase.com/organization/ybex-limited,"Apps, Financial Services, FinTech, Information Technology","27,310",1,,,,,,,,,,,,,,"Wan Chai, Hong Kong Island, Hong Kong",2,11-50,"Andrew Lee, Hui Li",2,1510000,USD,1510000,Seed,2017-04-12,1250000,USD,1250000,Seed,1250000,USD,1250000,Seed,1510000,USD,1510000,,,,,,,,,,,,,,,,,Private,,,,,,,,,,,,,,"28,131",,0,0.3,-0.4,"75,900","107,741.3",-26.07%,136,56.55%,2.66,71.08%,66.68%,-1.94%,"605,577","10,907",1.83%,55,2,"2,660",23,,,,,,,,2015-01-01,year,,,For Profit,,,,,"Apps, Financial Services, Information Technology, Software"
DimBuy.com Company Limited,https://www.crunchbase.com/organization/dimbuy-com-company-limited,"E-Commerce, Information Technology, Logistics, Online Portals","28,713",2,,,,,,,,,,,,,,"Hong Kong, Hong Kong Island, Hong Kong",1,51-100,Jimmy Ling,1,10000000,HKD,1289925,Early Stage Venture,2016-01-06,10000000,HKD,1289925,Series A,10000000,HKD,1289925,Series A,10000000,HKD,1289925,S.F. Express,,1,,,,,,,,,,,,,,Private,,,,,,,,,,,,,,"29,582",,-0.1,0,-0.2,"217,408","261,461.88",-6.9%,292,14.87%,6.98,5.94%,17.71%,-4.38%,"178,999","15,100",9.21%,31,3,,,,,,,,,,2011-02-17,day,,,For Profit,,,,,"Commerce and Shopping, Information Technology, Internet Services, Transportation"
BSD Education,https://www.crunchbase.com/organization/bsd-code-and-design-academy,"EdTech, Education, Information Technology, STEM Education","28,953",1,Less than $1M,,,,,,,,,,,,,"Sheung Wan, Hong Kong Island, Hong Kong",3,11-50,"Christopher Geary, Naveen Khugputh, Nickey Khemchandani",3,4450000,USD,4450000,Early Stage Venture,2018-01-08,2500000,USD,2500000,Series A,2500000,USD,2500000,Series A,4450000,USD,4450000,,,,,,,,,,,,,,,,,Private,,,,,,,,,,,,,,"29,828",,-0.2,0.4,3.8,"44,127","36,230.74",0.05%,440,-6.26%,5.85,-34.11%,35.61%,22.66%,"681,493","137,921",25.37%,43,,,,,,,,,,,2013-09-01,month,,,For Profit,,,,,"Education, Information Technology, Science and Engineering, Software"
SmartUp,https://www.crunchbase.com/organization/smartup-b539,"Blockchain, Information Technology, Service Industry","33,321",,,,,,,,,,,,,,,"Hong Kong, Hong Kong Island, Hong Kong",3,,"Ender Xu, Fay Lam, Ric Wu",2,5000000,USD,5000000,,2018-09-11,,,,Corporate Round,,,,Corporate Round,5000000,USD,5000000,"Blockchain Japan, DCapital, Soul Capital",1,3,,,,,,,,,,,,,,Private,,,,,,,,,,,,,,"34,332",,-0.1,0.8,-0.3,,192.31,-100%,,,,,,,,,,5,,,,,,,,,,,,,,,,,,,,Information Technology
Li Tong Group,https://www.crunchbase.com/organization/li-tong-group,"Electronics, Information Technology, Recycling, Supply Chain Management","35,115",,$100M to $500M,,,,,,,,,,,,,"Hong Kong, Hong Kong Island, Hong Kong",,251-500,,1,45000000,USD,45000000,,2015-12-10,45000000,USD,45000000,Venture - Series Unknown,45000000,USD,45000000,Venture - Series Unknown,45000000,USD,45000000,Olympus Capital Holdings Asia,1,1,,,,,,,,,,,,,,Private,,,,,,,,,,,,,1,"36,186",,-0.3,-0.2,0.4,"7,074","8,317.14",-21.89%,82,6.97%,4.14,9.11%,21.51%,2.38%,"2,639,797","358,601",15.72%,21,,,,,,,,,,,2000-01-01,year,,,For Profit,,,,,"Consumer Electronics, Hardware, Information Technology, Sustainability, Transportation"
Jobable,https://www.crunchbase.com/organization/jobable,"Human Resources, Information Technology, Recruiting","35,297",10,$1M to $10M,,,,,,,,,,,,,"Hong Kong, Hong Kong Island, Hong Kong",2,11-50,"Luke Byrne, Richard Hanson",2,2800000,USD,2800000,Seed,2017-01-01,2000000,USD,2000000,Seed,2000000,USD,2000000,Seed,2800000,USD,2800000,Welight Capital,1,1,,,,,,,,,,,,,,Private,,,,,,,,,,,,,,"36,371",,-0.3,-0.4,-0.8,"32,153","39,477.21",-2.64%,96,-17.7%,2.74,25.03%,66.85%,-1.86%,"1,049,112","-32,896",-3.04%,51,,,60,,,,,,,,2014-04-02,day,,,For Profit,,,,,"Information Technology, Professional Services"
MiOS,https://www.crunchbase.com/organization/mios,"Hardware, Information Technology, Smart Building, Smart Home, Software","37,958",,,,,,,,,,,,,,,"Kowloon City, Kowloon, Hong Kong",1,101-250,Lew Brown,1,4500000,USD,4500000,M&A,2016-05-19,4500000,USD,4500000,Venture - Series Unknown,4500000,USD,4500000,Venture - Series Unknown,4500000,USD,4500000,,,,,Was Acquired,MiOS acquired by eZLO,https://www.crunchbase.com/acquisition/ezlo-acquires-mios--317ee6f5,eZLO,https://www.crunchbase.com/organization/ezlo,2018-08-16,day,,,,Acquisition,,Private,,,,,,,,,,,,,,"39,110",,-0.2,0.3,-0.5,"101,924","118,642.33",46.85%,612,30.82%,6.98,-5.54%,16.69%,-0.65%,"304,428","-79,146",-20.63%,61,,,,,,,,,,,2008-01-01,year,2018-08-16,day,For Profit,,,,,"Consumer Electronics, Hardware, Information Technology, Real Estate, Software"
OpenANX,https://www.crunchbase.com/organization/openanx,"Asset Management, Blockchain, Financial Services, Information Technology, Risk Management","38,831",,,,,,,,,,,,,,,"Wan Chai, Hong Kong Island, Hong Kong",4,,"Dave Chapman, David Tee, Hugh Madden, Ken Lo",1,18756937,USD,18756937,,2017-05-07,18756937,USD,18756937,Initial Coin Offering,18756937,USD,18756937,Initial Coin Offering,18756937,USD,18756937,Dean Patrick,,1,,,,,,,,,,,,,,Private,,,,,,,,,,,,,1,"40,018",,0,1.7,1.1,"4,101","8,977.23",-63.02%,75,206.84%,3.56,61.45%,22.92%,18.87%,"4,045,079","1,576,189",63.84%,6,,,,,,,,,,,,,,,For Profit,,,,,"Financial Services, Information Technology"
HKDecoman,https://www.crunchbase.com/organization/hkdecoman,"Consulting, Information Technology, Internet","40,113",,,,,,,,,,,,,,,"Hong Kong, Hong Kong Island, Hong Kong",,,,1,1400000,USD,1400000,Seed,2018-12-14,1400000,USD,1400000,Seed,1400000,USD,1400000,Seed,1400000,USD,1400000,,,,,,,,,,,,,,,,,Private,,,,,,,,,,,,,,"41,353",,0.3,-0.1,-0.4,"170,608","319,290.16",-36.48%,83,-11.21%,1.68,-3.54%,77.36%,-4.21%,"386,161","134,744",53.59%,49,,,,,,,,,,,2016-01-01,year,,,,,,,,"Information Technology, Internet Services"
iView Displays,https://www.crunchbase.com/organization/iview-displays,"Electronics, Information Technology, Manufacturing","40,721",,$1M to $10M,,,,,,,,,,,,,"Wan Chai, Hong Kong Island, Hong Kong",,11-50,,2,36398707,USD,36398707,Late Stage Venture,2018-11-07,21643460,USD,21643460,Series C,21643460,USD,21643460,Series C,36398707,USD,36398707,"China Merchants Zhiyuan Capital Investment, China Merger & Acquisition Fund",2,2,,,,,,,,,,,,,,Private,,,,,,,,,,,,,,"41,983",,-0.2,1.1,-0.3,"2,127","3,474.88",35.08%,172,-42.79%,4.38,-31.79%,12.61%,12.61%,"5,815,355","-443,002",-7.08%,4,,,2,,,,,,,,2006-01-01,year,,,For Profit,,,,,"Consumer Electronics, Hardware, Information Technology, Manufacturing"
Smart Transfer,https://www.crunchbase.com/organization/smart-transfer,"Financial Services, Information Technology, Peer to Peer","42,203",2,,,,,,,,,,,,,,"Hong Kong, Hong Kong Island, Hong Kong",2,,"Ajeesh Sadanand, Francis Lu",1,1200000,HKD,154187,Seed,2017-05-04,1200000,HKD,154187,Seed,1200000,HKD,154187,Seed,1200000,HKD,154187,,,,,,,,,,,,,,,,,Private,,,,,,,,,,,,,,"43,510",,-0.4,0.9,-0.3,534,284.51,289.48%,,,1,0%,48.27%,-29.11%,"19,888,421","-13,430,948",-40.31%,5,,,11,,,,,,,,2016-05-21,day,,,,,,,,"Financial Services, Information Technology"
OKEx,https://www.crunchbase.com/organization/okex,"Blockchain, Financial Services, Information Technology, Internet","42,635",15,,,,,,,,,,,,,,"Hong Kong, Hong Kong Island, Hong Kong",,251-500,,,,,,,,,,,,,,,,,,,,,,,,,,,,,,,,,,,Private,,,,,,,,,,,,,5,"43,958",,0.1,5,3.2,"2,415,082","2,086,188.34",-4.05%,447,-16.57%,6.22,20.29%,39.74%,-2.64%,"22,381",-396,-1.74%,37,,,,,,,,,,,2017-01-01,year,,,For Profit,,,,,"Financial Services, Information Technology, Internet Services"
WOW App Inc.,https://www.crunchbase.com/organization/wow-app-inc,"Apps, Information Technology, Social Media","45,044",,Less than $1M,,,,,,,,,,,,,"Hong Kong, Hong Kong Island, Hong Kong",1,1-10,Pak Hou Chau,1,6000000,HKD,774198,Seed,2015-09-04,6000000,HKD,774198,Seed,6000000,HKD,774198,Seed,6000000,HKD,774198,,,,,,,,,,,,,,,,,Private,,,,,,,,,,,,,,"46,462",,-0.2,-0.1,0,,,,,,,,,,,,,27,1,,4,,,,,,,,2015-07-01,month,,,For Profit,,,,,"Apps, Information Technology, Internet Services, Media and Entertainment, Software"
Silentmode,https://www.crunchbase.com/organization/silentmode,"Health Care, Information Technology, Productivity Tools, Wellness","45,967",2,,,,,,,,,,,,,,"Central, Hong Kong Island, Hong Kong",2,1-10,"Bradley Dowding - Young, Jens Nielsen",1,150000,USD,150000,Seed,2017-05-03,150000,USD,150000,Seed,150000,USD,150000,Seed,150000,USD,150000,Brinc,,1,,,,,,,,,,,,,,Private,,,,,,,,,,,,,,"47,428",,0.4,0.5,0.3,"2,487","8,335.76",-75.33%,41,404.73%,1.43,35.05%,39.44%,21.32%,"8,620,254","4,839,978",128.03%,26,,,12,,,,,,,,2016-01-01,day,,,For Profit,,,,,"Health Care, Information Technology, Software"
Sensbeat,https://www.crunchbase.com/organization/sensbeat,"Information Services, Information Technology, Mobile, Music, Private Social Networking, Social Media","46,696",3,,,,,,,,,,,,,,"Hong Kong, Hong Kong Island, Hong Kong",3,1-10,"Ben Chan, Conrad Lo, Leo Wong",3,1041250,USD,1041250,Seed,2014-10-10,500000,USD,500000,Seed,500000,USD,500000,Seed,1041250,USD,1041250,"Big Bloom Investment, Cyberport Hong Kong, PYJ-Dynasty Venture Fund",,3,,,,,,,,,,,,,,Private,,,,,,,,,,,,,,"48,183",,-0.1,0,-0.1,,68.32,,,,,,,,,,,7,,,9,,,,,,,,2013-02-01,day,,,For Profit,,,,,"Community and Lifestyle, Information Technology, Internet Services, Media and Entertainment, Mobile, Music and Audio"
Travalian,https://www.crunchbase.com/organization/travalian,"Information Services, Information Technology, Internet, Mobile, Social Network, Travel","48,368",1,,,,,,,,,,,,,,"Hong Kong, Hong Kong Island, Hong Kong",3,51-100,"Dhaval Kankotiya, Paul Mears, Robert Fathers",3,50000,GBP,67881,Seed,2019-02-01,,,,Seed,,,,Seed,50000,GBP,67881,Paul Mears,1,1,,,,,,,,,,,,,,Private,,,,,,,,,,,,,,"49,937",,-0.2,-0.1,-0.9,31,160.73,-81.32%,23,165.04%,2,0%,,,"35,002,081","9,426,611",36.86%,44,,,14,,,,,,,,2017-06-01,day,,,For Profit,,,,,"Information Technology, Internet Services, Mobile, Travel and Tourism"
Lynk,https://www.crunchbase.com/organization/the-straits-network,"Consulting, Information Services, Information Technology","49,219",1,$1M to $10M,,,,,,,,,,,,,"Central, Hong Kong Island, Hong Kong",1,101-250,Peggy Choi,5,4000000,USD,4000000,,2018-01-22,,,,Venture - Series Unknown,,,,Venture - Series Unknown,4000000,USD,4000000,"Carman Chan, Click Ventures, CRE Venture Capital, Cyberport Hong Kong, Wavemaker Partners",1,7,,,,,,,,,,,,,,Private,,,,,,,,,,,,,,"50,821",,0,-0.1,0,"22,436","19,317.02",0.79%,544,-22.77%,7.92,-14.47%,11.77%,-16%,"1,020,316","110,315",12.12%,29,2,21,13,,,,,,,,2015-01-01,year,,,For Profit,,,,,Information Technology
GoGoChart,https://www.crunchbase.com/organization/gogochart,"App Marketing, Brand Marketing, Digital Marketing, Electronics, Information Technology, Marketing, Mobile","52,651",3,$1M to $10M,,,,,,,,,,,,,"Yau Tsim Mong, Kowloon, Hong Kong",1,11-50,Daniel Lo,1,500000,USD,500000,Seed,2017-03-14,500000,USD,500000,Seed,500000,USD,500000,Seed,500000,USD,500000,,,,,,,,,,,,,,,,,Private,,,,,,,,,,,,,9,"54,405",,0.6,1.3,-0.2,299,773.76,-37.89%,0,-92.32%,1.24,-28.53%,76.12%,34.66%,"22,473,807","5,406,622",31.68%,24,,,13,,,,,,,,2014-06-01,day,,,For Profit,,,,,"Consumer Electronics, Hardware, Information Technology, Mobile, Sales and Marketing"
eBeauty Asia,https://www.crunchbase.com/organization/ebeauty-asia,"Advertising, Beauty, E-Commerce, Information Technology, Software","53,884",,,,,,,,,,,,,,,"Hong Kong, Hong Kong Island, Hong Kong",2,1-10,"Nabil Rahmouni, Stéphane Chan-kam",1,67000,USD,67000,Seed,2019-01-29,67000,USD,67000,Pre-Seed,67000,USD,67000,Pre-Seed,67000,USD,67000,,,,,,,,,,,,,,,,,Private,,,,,,,,,,,,,2,"55,690",,-0.4,-0.4,8.7,86,31.07,-13.58%,,,1,0%,100%,0%,"33,069,059","391,300",1.2%,29,,,,,,,,,,,2018-11-05,day,,,For Profit,,,,,"Advertising, Commerce and Shopping, Consumer Goods, Information Technology, Sales and Marketing, Software"
ALAX,https://www.crunchbase.com/organization/alax,"Information Technology, Video Games","56,795",,,,,,,,,,,,,,,"Hong Kong, Hong Kong Island, Hong Kong",2,11-50,"Kalvin Feng, Matej Michalko",1,3800000,USD,3800000,,2018-05-03,3800000,USD,3800000,Initial Coin Offering,3800000,USD,3800000,Initial Coin Offering,3800000,USD,3800000,,,,,,,,,,,,,,,,,Private,,,,,,,,,,,,,,"58,740",,0,-0.3,-0.7,"50,250","19,862.49",218.34%,425,-58.32%,8.44,-65.69%,40.83%,15.36%,"548,942","-280,676",-33.83%,46,,,,,,,,,,,,,,,,,,,,"Gaming, Information Technology"
