Skygear,https://www.crunchbase.com/organization/skygear,"Apps, Information Technology, Mobile Apps, Open Source","310,076",,,,,,,,,,,,,,,"Kowloon City, Kowloon, Hong Kong",,,,,,,,,,,,,,,,,,,,,,,,,,,,,,,,,,,,,Private,,,,,,,,,,,,,,"333,901",,-0.4,-0.5,6.4,"19,851","19,368.2",13.09%,60,-43.97%,1.71,-20.51%,57.29%,2.51%,"1,747,436","122,045",7.51%,37,1,,20,,,,,,,,,,,,For Profit,,,,,"Apps, Information Technology, Mobile, Software"
Clarity,https://www.crunchbase.com/organization/clarity-15c7,"Information Technology, Software","311,091",,,,,,,,,,,,,,,"Mong Kok, Kowloon, Hong Kong",,1-10,,,,,,,,,,,,,,,,,,,,,,,,,,,,,,,,,,,Private,,,,,,,,,,,,,,"334,974",,-0.3,-0.3,6.4,410,364.46,-20.05%,12,-95.57%,1.77,-55.51%,26.95%,21.06%,"18,292,598","4,398,865",31.66%,16,,,,,,,,,,,2013-01-01,year,,,For Profit,,,,,"Information Technology, Software"
FoxGlobal,https://www.crunchbase.com/organization/foxglobal,"Information Technology, Software","312,739",,,,,,,,,,,,,,,"Tsuen Wan, New Territories, Hong Kong",,101-250,,,,,,,,,,,,,,,,,,,,,,,,,,,,,,,,,,,Private,,,,,,,,,,,,,,"336,723",,-0.3,1.2,6.4,211,147.57,30.81%,,,1,0%,100%,0%,"26,709,727","-2,479,888",-8.5%,19,,,,,,,,,,,2011-01-01,year,,,For Profit,,,,,"Information Technology, Software"
blackVPN,https://www.crunchbase.com/organization/blackvpn,"Information Technology, Internet, Privacy, Security","314,295",2,$1M to $10M,,,,,,,,,,,,,"Hong Kong, Hong Kong Island, Hong Kong",,,,,,,,,,,,,,,,,,,,,,,,,,,,,,,,,,,,,Private,,,,,,,,,,,,,,"338,390",,-0.4,-0.2,2.4,"21,385","31,373.7",-23.23%,176,77.2%,2.78,28.49%,31.23%,3.09%,"1,391,313","142,199",11.38%,43,1,"3,180",10,,,,,,,,2009-04-01,day,,,,,,,,"Information Technology, Internet Services, Privacy and Security"
eyes3,https://www.crunchbase.com/organization/eyes3,"Information Services, Information Technology, Software","315,154",,,,,,,,,,,,,,,"Kwun Tong, Kowloon, Hong Kong",1,1-10,Ernest Chen,,,,,,,,,,,,,,,,,,,,,,,,,,,,,,,,,,Private,,,,,,,,,,,,,,"339,303",,-0.4,-0.5,6.3,,"13,278.43",,,,,,,,,,,13,,,,,,,,,,,,,,,For Profit,,,,,"Information Technology, Software"
Waypoint Asia,https://www.crunchbase.com/organization/waypoint-asia,"Information Technology, Mobile","315,534",,Less than $1M,,,,,,,,,,,,,"Hong Kong, Hong Kong Island, Hong Kong",3,1-10,"Bob Bunger, Marie Anne Biole, Paul Hitchens",,,,,,,,,,,,,,,,,,,,,,,,,,,,,,,,,,Private,,,,,,,,,,,,,,"339,707",,1.2,0,-0.7,,,,,,,,,,,,,5,,,,0,3,,Scientific and electric apparatus and instruments,,,,2014-01-08,day,,,,,,,,"Information Technology, Mobile"
Remailder,https://www.crunchbase.com/organization/remailder,"Apps, Information Technology, Internet, Messaging, Mobile Apps","315,724",,Less than $1M,,,,,,,,,,,,,"Hong Kong, Hong Kong Island, Hong Kong",,1-10,,,,,,,,,,,,,,,,,,,,,,,,,,,,,,,,,,,Private,,,,,,,,,,,,,,"339,912",,0,-0.5,-0.6,,,,,,,,,,,,,5,,,1,,,,,,,,2012-11-02,day,,,For Profit,,,,,"Apps, Information Technology, Internet Services, Messaging and Telecommunications, Mobile, Software"
ExcessChip Technology Limited,https://www.crunchbase.com/organization/excesschip-technology-limited,"Information Technology, Manufacturing","315,840",,,,,,,,,,,,,,,"Hong Kong, Hong Kong Island, Hong Kong",,51-100,,,,,,,,,,,,,,,,,,,,,,,,,,,,,,,,,,,Private,,,,,,,,,,,,,,"340,034",,0,0.4,4.6,"1,983","3,635",-32.88%,167,"2,602.51%",6.95,473.95%,46.82%,-22.96%,"5,484,633","-2,048,935",-27.2%,13,,,,,,,,,,,,,,,For Profit,,,,,"Information Technology, Manufacturing"
Microskills,https://www.crunchbase.com/organization/microskills,"Apps, E-Learning, EdTech, Education, Information Technology","317,257",,,,,,,,,,,,,,,"Hong Kong, Hong Kong Island, Hong Kong",2,1-10,"Raman Saxena, Rayan Nait Mazi",,,,,,,,,,,,,,,,,,,,,,,,,,,,,,,,,,Private,,,,,,,,,,,,,,"341,542",,-0.4,-0.4,6.4,,13.68,,,,,,,,,,,6,,,,,,,,,,,2018-01-01,year,,,For Profit,,,,,"Apps, Education, Information Technology, Software"
Vioo,https://www.crunchbase.com/organization/vioo,Information Technology,"317,268",,,,,,,,,,,,,,,"Hong Kong, Hong Kong Island, Hong Kong",,,,,,,,M&A,,,,,,,,,,,,,,,,,Was Acquired,Vioo acquired by BExcellent Group Holdings,https://www.crunchbase.com/acquisition/bexcellent-group-holdings-acquires-vioo--02916f38,BExcellent Group Holdings,https://www.crunchbase.com/organization/bexcellent-group-holdings,2019-01-23,day,,,,Acquisition,,Private,,,,,,,,,,,,,,"341,553",,0.3,-0.3,4,"2,318","1,093.5",100.4%,287,-1.73%,7.47,8.57%,6.72%,2.59%,"5,030,774","-3,102,839",-38.15%,31,,,,,,,,,,,,,2019-01-23,day,,,,,,Information Technology
Mindvivid,https://www.crunchbase.com/organization/mindvivid,"Information Services, Information Technology","317,387",,,,,,,,,,,,,,,"Sha Tin, New Territories, Hong Kong",3,11-50,"Isaac Lam, Isabel Lo, Kent Wang",,,,,,,,,,,,,,,,,,,,,,,,,,,,,,,,,,Private,,,,,,,,,,,,,,"341,684",,0.7,-0.5,6.3,517,491.23,104.4%,55,84.79%,2.39,-30.42%,42.97%,14.27%,"15,727,853","-3,780,132",-19.38%,17,,,,,,,,,,,2015-01-01,year,,,For Profit,,,,,Information Technology
WeTech,https://www.crunchbase.com/organization/wetech-2fc3,"Information Technology, Web Development","320,262",,,,,,,,,,,,,,,"Hong Kong, Hong Kong Island, Hong Kong",,11-50,,,,,,,,,,,,,,,,,,,,,,,,,,,,,,,,,,,Private,,,,,,,,,,,,,,"344,759",,-0.4,0.2,6.3,310,412.62,-70.08%,32,"1,660.35%",3.23,61.58%,,,"18,104,219","4,616,408",34.23%,22,,,,,,,,,,,2015-01-01,year,,,For Profit,,,,,"Information Technology, Software"
Proxor,https://www.crunchbase.com/organization/proxor,"EdTech, Information Technology","324,166",,,,,,,,,,,,,,,"Quarry Bay, Hong Kong Island, Hong Kong",2,11-50,"Henry Hon, Philip Miller",,,,,,,,,,,,,,,,,,,,,,,,,,,,,,,,,,Private,,,,,,,,,,,,,,"348,890",,2.2,0.9,6.2,"1,128","1,040.82",146.31%,115,-86.59%,2.1,-68.44%,25.56%,25.56%,"12,202,489","-365,778",-2.91%,24,,,,,,,,,,,,,,,For Profit,,,,,"Education, Information Technology, Software"
Wise At Work,https://www.crunchbase.com/organization/wise-at-work,"Education, Information Technology","325,041",,,,,,,,,,,,,,,"Hong Kong, Hong Kong Island, Hong Kong",1,1-10,Priyanka Gothi,,,,,,,,,,,,,,,,,,,,,,,,,,,,,,,,,,Private,,,,,,,,,,,,,,"349,822",,-0.4,-0.4,6.3,634,401.29,11.54%,346,,6.66,565.98%,33.4%,-30.26%,"10,673,631","-8,413,930",-44.08%,20,,,,,,,,,,,2017-01-01,year,,,For Profit,,,,,"Education, Information Technology"
Shanzhai City,https://www.crunchbase.com/organization/shanzhai-city,"Impact Investing, Information Technology, Social Assistance","328,128",,,,,,,,,,,,,,,"Hong Kong, Hong Kong Island, Hong Kong",,11-50,,,,,,,,,,,,,,,,,,,,,,,,,,,,,,,,,,,Private,,,,,,,,,,,,,,"353,088",,1,-0.1,6.1,71,92.32,-79.61%,57,-84.51%,2,20.98%,0%,-67.34%,"32,431,670","12,536,514",63.01%,10,,,7,,,,,,,,2015-01-01,year,,,For Profit,,,,,"Financial Services, Government and Military, Information Technology, Lending and Investments"
3DP Technology Limited,https://www.crunchbase.com/organization/3dp-technology-limited,"Information Technology, Manufacturing","328,355",,Less than $1M,,,,,,,,,,,,,"Hong Kong, Hong Kong Island, Hong Kong",,1-10,,,,,,,,,,,,,,,,,,,,,,,,,,,,,,,,,,,Private,,,,,,,,,,,,,1,"353,337",,0.3,0,-0.9,,,,,,,,,,,,,2,,,,,,,,,,,2013-09-26,day,,,,,,,,"Information Technology, Manufacturing"
Future Impact Lab,https://www.crunchbase.com/organization/future-impact-lab,Information Technology,"332,355",,,,,,,,,,,,,,,"New Territories, New Territories, Hong Kong",1,,Ernest Lo,,,,,,,,,,,,,,,,,,,,,,,,,,,,,,,,,,Private,,,,,,,,,,,,,,"357,605",,-0.3,1.8,6.2,,,,,,,,,,,,,5,,,,,,,,,,,2015-01-01,year,,,For Profit,,,,,Information Technology
Remotec Technology,https://www.crunchbase.com/organization/remotec-technology,"Computer, CRM, Information Technology, Manufacturing, Software","333,234",,$1M to $10M,,,,,,,,,,,,,"Kowloon City, Kowloon, Hong Kong",,11-50,,,,,,,,,,,,,,,,,,,,,,,,,,,,,,,,,,,Private,,,,,,,,,,,,,,"358,528",,-0.4,-0.4,-0.6,"41,571","25,809.21",-52.13%,64,710.82%,1.55,24.9%,22.65%,-16.27%,"1,162,054","405,678",53.63%,6,,,,,,,,,,,1988-01-01,year,,,For Profit,,,,,"Consumer Electronics, Hardware, Information Technology, Manufacturing, Sales and Marketing, Software"
International Blockchain Olympiad,https://www.crunchbase.com/organization/international-blockchain-olympiad,"Blockchain, Information Technology","334,326",,,,,,,,,,,,,,,"Hong Kong, Hong Kong Island, Hong Kong",,1-10,,,,,,,,,,,,,,,,,,,,,,,,,,,,,,,,,,,Private,,,,,,,,,,,,,,"359,701",,0.6,3.4,6.1,910,"14,525.78",90.57%,92,-41.77%,2.8,-25.96%,37.18%,18.71%,"11,395,998","-3,914,954",-25.57%,9,,,,,,,,,,,2018-01-01,year,,,For Profit,,,,,Information Technology
Connectie,https://www.crunchbase.com/organization/connectie,"Artificial Intelligence, Information Services, Information Technology, SaaS","339,753",,,,,,,,,,,,,,,"Mong Kok, Kowloon, Hong Kong",1,11-50,Alan Chan,,,,,,,,,,,,,,,,,,,,,,,,,,,,,,,,,,Private,,,,,,,,,,,,,,"365,479",,1.2,-0.4,6.1,57,288.37,-87.92%,,,1,0%,0%,-30.61%,"35,161,211","12,623,781",56.01%,14,,,2,,,,,,,,2015-01-01,year,,,For Profit,,,,,"Artificial Intelligence, Data and Analytics, Information Technology, Science and Engineering, Software"
Elpine Technologies Limited,https://www.crunchbase.com/organization/elpine-technologies-limited,"Information Technology, Software","341,490",,,,,,,,,,,,,,,"North Point, Hong Kong Island, Hong Kong",,,,,,,,,,,,,,,,,,,,,,,,,,,,,,,,,,,,,Private,,,,,,,,,,,,,,"367,327",,-0.4,0,0.9,,77.33,,,,,,,,,,,4,,,,,,,,,,,1999-10-18,day,,,,,,,,"Information Technology, Software"
Abiqos,https://www.crunchbase.com/organization/abiqos,"Financial Services, FinTech, Information Technology, Software","342,835",,Less than $1M,,,,,,,,,,,,,"Kowloon City, Kowloon, Hong Kong",,,,,,,,,,,,,,,,,,,,,,,,,,,,,,,,,,,,,Private,,,,,,,,,,,,,,"368,733",,3.5,1.8,0.4,,"15,740.24",,,,,,,,,,,45,,,22,,,,,,,,,,,,,,,,,"Financial Services, Information Technology, Software"
A-Max Technology,https://www.crunchbase.com/organization/a-max-technology,"Audio, Information Technology, Wireless","346,292",,,,,,,,,,,,,,,"Tsuen Wan, New Territories, Hong Kong",,1001-5000,,1,60000000,USD,60000000,Early Stage Venture,2005-06-01,60000000,USD,60000000,Series A,60000000,USD,60000000,Series A,60000000,USD,60000000,General Atlantic,,1,,,,,,,,,,,,,,Private,,,,,,,,,,,,,,"372,401",,-0.2,-0.4,-0.6,,,,,,,,,,,,,,,,,0,2,,Scientific and electric apparatus and instruments,,,,2003-03-27,day,,,For Profit,,,,,"Hardware, Information Technology, Media and Entertainment, Mobile, Music and Audio"
Skylab Mobile Systems,https://www.crunchbase.com/organization/skylab-mobile-systems,"Information Technology, Mobile","348,558",,$1M to $10M,,,,,,,,,,,,,"Causeway Bay, Hong Kong Island, Hong Kong",,1-10,,,,,,,,,,,,,,,,,,,,,,,,,,,,,,,,,,,Private,,,,,,,,,,,,,,"374,794",,0.4,0.4,0.3,"2,150","2,303.36",-4.67%,45,-59.57%,2.22,41.36%,58.48%,23.12%,"7,413,941","-840,896",-10.19%,8,,,4,,,,,,,,2005-01-01,year,,,,,,,,"Information Technology, Mobile"
VSTECS,https://www.crunchbase.com/organization/vstecs,"Computer, Information Technology","349,362",,,,,,,,,,,,,,,"Sheung Wan, Hong Kong Island, Hong Kong",1,,Jialin Li,,,,,,,,,,,,,,,,,,,,,,,,,,,,,,,,,,Private,,,,,,,,,,,,,,"375,656",,-0.5,-0.6,0,"19,470","14,313.44",0.52%,750,6.57%,7.25,-17.9%,25.69%,2.55%,"1,084,723","110,209",11.31%,6,,,,,,,,,,,,,,,For Profit,,,,,"Consumer Electronics, Hardware, Information Technology"
Horizon Technology,https://www.crunchbase.com/organization/horizon-technology-and-solution-limited,"Consulting, Information Technology, Web Development","351,073",,,,,,,,,,,,,,,"Sha Tin, New Territories, Hong Kong",1,1-10,Fai Wong,,,,,,,,,,,,,,,,,,,,,,,,,,,,,,,,,,Private,,,,,,,,,,,,,,"377,477",,-0.3,-0.1,-0.4,111,32.07,,,,1,,100%,,"31,935,016",,,42,,,,,,,,,,,2013-08-01,month,,,For Profit,,,,,"Information Technology, Software"
PantaRei Design Limited,https://www.crunchbase.com/organization/pantarei-design-limited,"Consulting, Information Technology, Software","351,230",,Less than $1M,,,,,,,,,,,,,"North Point, Hong Kong Island, Hong Kong",,1-10,,,,,,,,,,,,,,,,,,,,,,,,,,,,,,,,,,,Private,,,,,,,,,,,,,,"377,644",,0.1,1.8,-0.3,48,44.18,-44.44%,34,272.6%,6,200%,,,"31,690,413","29,557",0.09%,19,,,,,,,,,,,2010-07-01,day,,,,,,,,"Information Technology, Software"
Cypress Telecom,https://www.crunchbase.com/organization/cypress-telecom,Information Technology,"352,592",,,,,,,,,,,,,,,"Wan Chai, Hong Kong Island, Hong Kong",,251-500,,,,,,,,,,,,,,,,,,,,,,,,,,,,,,,,,,,Private,,,,,,,,,,,,,1,"379,081",,-0.3,-0.2,-0.1,883,"1,467.73",74.28%,30,-87.24%,2.67,-56.78%,60.83%,32.57%,"11,418,452","-753,215",-6.19%,4,,,,,,,,,,,2003-01-01,year,,,For Profit,,,,,Information Technology
Amotion Labs,https://www.crunchbase.com/organization/amotion-labs,"Blockchain, Information Technology, Insurance","356,800",,Less than $1M,,,,,,,,,,,,,"Hong Kong, Hong Kong Island, Hong Kong",,,,,,,,,,,,,,,,,,,,,,,,,,,,,,,,,,,,,Private,,,,,,,,,,,,,1,"383,561",,-0.5,-0.9,-0.3,,75.58,-100%,,,,,,,,,,33,,,,,,,,,,,2012-01-01,year,,,For Profit,,,,,"Financial Services, Information Technology"
Global Technology Integrator,https://www.crunchbase.com/organization/global-technology-integrator,Information Technology,"362,961",,,,,,,,,,,,,,,"Kwun Tong, Kowloon, Hong Kong",,11-50,,,,,,,,,,,,,,,,,,,,,,,,,,,,,,,,,,,Private,,,,,,,,,,,,,,"390,045",,-0.3,1.9,2.7,415,426.61,-28.66%,7,-83.31%,1.45,-56.99%,70.22%,70.22%,"19,509,303","6,243,810",47.07%,3,,,,,,,,,,,1989-01-01,year,,,For Profit,,,,,Information Technology
Venturenix,https://www.crunchbase.com/organization/venturenix,"Digital Marketing, Information Technology, Recruiting, Staffing Agency","365,874",,,,,,,,,,,,,,,"Sheung Wan, Hong Kong Island, Hong Kong",2,1-10,"Alvin Lam, Dicky Yuen",,,,,,,,,,,,,,,,,,,,,,,,,,,,,,,,,,Private,,,,,,,,,,,,,,"393,122",,-0.5,-1,5.7,"1,922","1,990.81",-31.39%,14,-90.86%,1.12,-75.27%,44.83%,11.04%,"10,641,757","5,638,623",112.7%,22,,,,,,,,,,,2017-01-01,year,,,For Profit,,,,,"Administrative Services, Information Technology, Professional Services, Sales and Marketing"
Pacific Telecom & Navigation Limited,https://www.crunchbase.com/organization/pacific-telecom-navigation-limited,"Information Technology, Telecommunications","368,342",,,,,,,,,,,,,,,"Sha Tin, New Territories, Hong Kong",,,,,,,,,,,,,,,,,,,,,,,,,,,,,,,,,,,,,Private,,,,,,,,,,,,,,"395,753",,-0.2,1.1,0.8,107,219.04,-75.65%,,,1,-94.94%,100%,100%,"32,789,780","22,017,875",204.4%,3,,,,,,,,,,,2015-06-29,day,,,,,,,,"Hardware, Information Technology"
BizCoach,https://www.crunchbase.com/organization/bizcoach,Information Technology,"369,444",,,,,,,,,,,,,,,"Cyberport, Hong Kong Island, Hong Kong",2,,"Axel Scholz, H.R. Shiever",,,,,,,,,,,,,,,,,,,,,,,,,,,,,,,,,,Private,,,,,,,,,,,,,,"396,920",,-0.3,-0.1,2.6,113,65.1,10.68%,,,1,-50%,100%,100%,"32,903,034","2,760,691",9.16%,16,,,,,,,,,,,,,,,For Profit,,,,,Information Technology
Hermes Partners International,https://www.crunchbase.com/organization/hermes-partners-international,"Consulting, Information Technology","370,620",,,,,,,,,,,,,,,"Hong Kong, Hong Kong Island, Hong Kong",,,,,,,,,,,,,,,,,,,,,,,,,,,,,,,,,,,,,Private,,,,,,,,,,,,,,"398,172",,-0.4,-0.2,0.8,,12.43,,,,,,,,,,,7,,,,,,,,,,,,,,,For Profit,,,,,Information Technology
Ta Solutions Ltd,https://www.crunchbase.com/organization/ta-solutions-ltd,"Enterprise Software, Information Technology, Software","370,745",,,,,,,,,,,,,,,"Hong Kong, Hong Kong Island, Hong Kong",,,,,,,,,,,,,,,,,,,,,,,,,,,,,,,,,,,,,Private,,,,,,,,,,,,,1,"398,304",,1.2,-0.4,3.6,,,,,,,,,,,,,4,,,7,,,,,,,,2015-07-24,day,,,For Profit,,,,,"Information Technology, Software"
Greenblack,https://www.crunchbase.com/organization/greenblack,"Consulting, FinTech, Information Technology, Management Consulting","370,860",,,,,,,,,,,,,,,"Hong Kong, Hong Kong Island, Hong Kong",2,1-10,"Colin Blackwell, Jonathan Green",,,,,,,,,,,,,,,,,,,,,,,,,,,,,,,,,,Private,,,,,,,,,,,,,,"398,430",,3.3,1.5,-0.3,,,,,,,,,,,,,17,,,,,,,,,,,2018-09-01,day,,,For Profit,,,,,"Financial Services, Information Technology, Professional Services"
PixelAlpha,https://www.crunchbase.com/organization/pixelalpha,"Financial Services, FinTech, Information Technology","373,781",,,,,,,,,,,,,,,"Hong Kong, Hong Kong Island, Hong Kong",,1-10,,,,,,,,,,,,,,,,,,,,,,,,,,,,,,,,,,,Private,,,,,,,,,,,,,,"401,543",,1.4,1.1,-0.5,,61.24,,,,,,,,,,,11,,,,,,,,,,,2018-01-01,month,,,For Profit,,,,,"Financial Services, Information Technology"
UrbanTack HK,https://www.crunchbase.com/organization/urbantack-hk-limited,"Apps, Information Services, Information Technology","374,640",,,,,,,,,,,,,,,"Kwun Tong, Kowloon, Hong Kong",1,1-10,Moumita Dey,,,,,,,,,,,,,,,,,,,,,,,,,,,,,,,,,,Private,,,,,,,,,,,,,,"402,460",,-0.4,-0.8,2,,,,,,,,,,,,,24,,,,,,,,,,,2018-03-07,day,,,For Profit,,,,,"Apps, Information Technology, Software"
New World TMT Ltd,https://www.crunchbase.com/organization/new-world-tmt-ltd,"Information Technology, News, Telecommunications","375,552",,,1,,,,,,,,,,,,"Hong Kong, Hong Kong Island, Hong Kong",,11-50,,,,,,,,,,,,,,,,,,,,,,,,,,,,,,,,,,,Private,,,,,,,,,,,,,,"403,436",,4.2,4.4,2.2,"1,070","1,230.83",,,,1,,28.29%,,"15,936,060",,,3,,,,,,,,,,,1995-01-01,year,,,,,,1,,"Content and Publishing, Hardware, Information Technology, Media and Entertainment"
Power Non Stop,https://www.crunchbase.com/organization/power-non-stop-limited,"Advertising, Consumer, Hardware, Information Technology, Telecommunications","375,713",,$1M to $10M,,,,,,,,,,,,,"Hong Kong, Hong Kong Island, Hong Kong",,1-10,,,,,,,,,,,,,,,,,,,,,,,,,,,,,,,,,,,Private,,,,,,,,,,,,,,"403,615",,-0.4,-0.6,3.1,,,,,,,,,,,,,2,,,,,,,,,,,2013-12-01,day,,,,,,,,"Advertising, Hardware, Information Technology, Sales and Marketing"
Nikoyo,https://www.crunchbase.com/organization/nikoyo,Information Technology,"378,373",,$10M to $50M,,,,,,,,,,,,,"Hong Kong, Hong Kong Island, Hong Kong",,101-250,,,,,,,,,,,,,,,,,,,,,,,,,,,,,,,,,,,Private,,,,,,,,,,,,,,"406,439",,-0.1,0,-0.1,"1,042","1,214.72",23.89%,363,190.87%,2.57,-91.5%,26.75%,-11.05%,"11,187,771","5,361,069",92.01%,7,,,,,,,,,,,1985-01-01,year,,,For Profit,,,,,Information Technology
CN Innovations Holdings Ltd.,https://www.crunchbase.com/organization/cn-innovations-holdings-ltd,"Information Technology, Manufacturing","382,901",,,2,1,,,,,,,,,,,"Hong Kong, Hong Kong Island, Hong Kong",,,,1,,,,Private Equity,2007-12-04,,,,Private Equity,,,,Private Equity,,,,AIF Capital,1,1,,,,,,,,,,,,,,Private,,,,,,,,,,,,,,"411,233",,-0.3,-0.4,-1.3,"13,698","5,757.58",14.82%,788,-8.33%,7.85,-19.58%,7.6%,5.02%,"1,554,454","54,900",3.66%,8,,,,,,,,,,,,,,,,,,2,,"Information Technology, Manufacturing"
LessLoop,https://www.crunchbase.com/organization/lessloop-limited,"Information Technology, Machine Learning, Software","383,878",,,,,,,,,,,,,,,"Kwun Tong, Kowloon, Hong Kong",1,1-10,Wang Chiu Chan,,,,,,,,,,,,,,,,,,,,,,,,,,,,,,,,,,Private,,,,,,,,,,,,,,"412,267",,-0.3,-0.3,2.1,83,233.51,,,,1,,100%,,"33,204,056",,,32,,,9,,,,,,,,,,,,For Profit,,,,,"Artificial Intelligence, Data and Analytics, Information Technology, Software"
Darts Connect,https://www.crunchbase.com/organization/darts-connect,"Apps, Hardware, Information Technology, Internet of Things, Online Games","384,264",,,,,,,,,,,,,,,"Mong Kok, Kowloon, Hong Kong",1,,Chun Wing Freeman Ho,,,,,,,,,,,,,,,,,,,,,,,,,,,,,,,,,,Private,,,,,,,,,,,,,,"412,674",,-0.4,-0.9,5.5,214,"5,691.19",-96.76%,58,,1.82,82.4%,50%,20.65%,"23,850,179","18,380,661",336.06%,16,,,,,,,,,,,2015-01-01,year,,,For Profit,,,,,"Apps, Gaming, Hardware, Information Technology, Internet Services, Software"
Biscovery,https://www.crunchbase.com/organization/biscovery,"Analytics, Information Technology, Management Consulting","388,756",,,,,,,,,,,,,,,"Kowloon City, Kowloon, Hong Kong",1,11-50,Ray Wong,,,,,,,,,,,,,,,,,,,,,,,,,,,,,,,,,,Private,,,,,,,,,,,,,,"417,422",,1.7,-0.2,-0.8,,117.78,-100%,,,,,,,,,,14,,,,,,,,,,,2015-01-01,year,,,For Profit,,,,,"Data and Analytics, Information Technology, Professional Services"
Vanda Group,https://www.crunchbase.com/organization/vanda-group,Information Technology,"392,206",,,,,,,,,,,,,,,"Kowloon City, Kowloon, Hong Kong",,251-500,,,,,,M&A,,,,,,,,,,,,,,,,,Was Acquired,Vanda Group acquired by Avnet,https://www.crunchbase.com/acquisition/avnet-acquires-vanda-group--1d9f6fc4,Avnet,https://www.crunchbase.com/organization/avnet,2009-10-14,day,,,,Acquisition,,Private,,,,,,,,,,,,,,"421,090",,-0.3,2.6,-0.8,,28.17,-100%,,,,,,,,,,4,,,,,,,,,,,1982-01-01,year,2009-10-14,day,For Profit,,,,,Information Technology
Labwork,https://www.crunchbase.com/organization/labwork,"E-Learning, EdTech, Education, Information Technology, Internet, Video","392,384",,,,,,,,,,,,,,,"Sha Tin, New Territories, Hong Kong",,1-10,,,,,,,,,,,,,,,,,,,,,,,,,,,,,,,,,,,Private,,,,,,,,,,,,,,"421,278",,-0.3,0,5.4,91,28.87,,,,1,,100%,,"32,837,542",,,8,,,,,,,,,,,2018-01-01,year,,,For Profit,,,,,"Education, Information Technology, Internet Services, Media and Entertainment, Software, Video"
ToolTwist,https://www.crunchbase.com/organization/tooltwist,"Information Technology, Software","393,034",,Less than $1M,,,,,,,,,,,,,"Hong Kong, Hong Kong Island, Hong Kong",,11-50,,,,,,,,,,,,,,,,,,,,,,,,,,,,,,,,,,,Private,,,,,,,,,,,,,,"421,970",,0.2,0.1,1.6,"6,434","6,570.02",5.28%,54,35.99%,1.93,31.1%,54.02%,-12.06%,"3,502,690","-380,975",-9.81%,18,1,,10,,,,,,,,,,,,,,,,,"Information Technology, Software"
TheraTalk,https://www.crunchbase.com/organization/theratalk,"Health Care, Information Technology, Internet, Psychology","394,956",,,,,,,,,,,,,,,"Hong Kong, Hong Kong Island, Hong Kong",,1-10,,,,,,,,,,,,,,,,,,,,,,,,,,,,,,,,,,,Private,,,,,,,,,,,,,,"424,011",,-0.3,1.9,-0.4,,"1,181.66",-100%,,,,,,,,,,15,,,,,,,,,,,2017-01-01,year,,,,,,,,"Health Care, Information Technology, Internet Services"
EDGE Enterprises,https://www.crunchbase.com/organization/edge-enterprises,"Information Technology, Marketing, Training","395,434",,,,,,,,,,,,,,,"Kowloon City, Kowloon, Hong Kong",1,11-50,Gerald Eder,,,,,,,,,,,,,,,,,,,,,,,,,,,,,,,,,,Private,,,,,,,,,,,,,,"424,511",,0.8,4.9,5.4,47,7.87,,,,1,,100%,,"34,747,169",,,2,,,,,,,,,,,,,,,For Profit,,,,,"Education, Information Technology, Sales and Marketing"
HGC Global Communications,https://www.crunchbase.com/organization/hgc-global-communications,"Information Technology, Telecommunications","395,847",,,1,,,,,,,,,,,,"Hong Kong, Hong Kong Island, Hong Kong",,,,,,,,,,,,,,,,,,,,,,,,,,,,,,,,,,,,,Private,,,,,,,,,,,,,,"424,958",,-0.3,0.2,-0.9,,,,,,,,,,,,,,,,,,,,,,,,,,,,,,,1,,"Hardware, Information Technology"
RedSo,https://www.crunchbase.com/organization/redso,"Information Technology, Product Design","396,577",,,,,,,,,,,,,,,"Kowloon City, Kowloon, Hong Kong",1,,Eric Ng,,,,,,,,,,,,,,,,,,,,,,,,,,,,,,,,,,Private,,,,,,,,,,,,,,"425,728",,1.9,2.8,5.3,"9,248","24,028.05",120.23%,113,"4,202.82%",1.93,15.59%,42.72%,-8.2%,"3,404,260","-2,751,677",-44.7%,55,,"3,212",,,,,,,,,2011-01-01,year,,,For Profit,,,,,"Design, Information Technology"
Malabar AI,https://www.crunchbase.com/organization/malabar-ai,Information Technology,"398,648",,,,,,,,,,,,,,,"Central, Hong Kong Island, Hong Kong",,1-10,,,,,,,,,,,,,,,,,,,,,,,,,,,,,,,,,,,Private,,,,,,,,,,,,,,"427,916",,2.5,4.9,5.2,164,71.72,,,,1,,100%,,"29,054,362",,,7,,,,,,,,,,,2017-01-01,year,,,For Profit,,,,,Information Technology
Big Bang Markets Limited,https://www.crunchbase.com/organization/big-bang-markets-limited,"Information Technology, Product Design, Robotics, Software","399,731",,,,,,,,,,,,,,,"Hong Kong, Hong Kong Island, Hong Kong",,1-10,,,,,,,,,,,,,,,,,,,,,,,,,,,,,,,,,,,Private,,,,,,,,,,,,,,"429,062",,1.2,-0.1,-0.3,,,,,,,,,,,,,,,,,,,,,,,,2016-12-20,day,,,For Profit,,,,,"Design, Hardware, Information Technology, Science and Engineering, Software"
Luxe Observer,https://www.crunchbase.com/organization/luxe-observer,"Communities, Information Technology","403,662",,,,,,,,,,,,,,,"Hong Kong, Hong Kong Island, Hong Kong",1,1-10,Virginie Morin,,,,,,,,,,,,,,,,,,,,,,,,,,,,,,,,,,Private,,,,,,,,,,,,,,"433,227",,2.4,-0.3,5.1,,"1,349.62",-100%,,,,,,,,,,19,,,2,,,,,,,,2014-01-01,year,,,For Profit,,,,,"Community and Lifestyle, Information Technology"
Ooosh,https://www.crunchbase.com/organization/ooosh,"Communities, Information Technology, Internet","404,469",,,,,,,,,,,,,,,"Kowloon City, Kowloon, Hong Kong",,1-10,,,,,,,,,,,,,,,,,,,,,,,,,,,,,,,,,,,Private,,,,,,,,,,,,,1,"434,082",,-0.3,-0.5,0.2,,271.78,,,,,,,,,,,6,,,17,,,,,,,,2015-01-01,year,,,For Profit,,,,,"Community and Lifestyle, Information Technology, Internet Services"
Everbest Technologies,https://www.crunchbase.com/organization/everbest-technologies,"Information Technology, Network Hardware","405,993",,,,,,,,,,,,,,,"Hong Kong, Hong Kong Island, Hong Kong",,1-10,,,,,,,,,,,,,,,,,,,,,,,,,,,,,,,,,,,Private,,,,,,,,,,,,,,"435,689",,-0.3,-0.3,-0.3,"19,078","43,391.86",4.48%,167,10.93%,2.27,2.11%,62.47%,11.98%,"1,642,719","-26,264",-1.57%,25,,,,,,,,,,,1991-01-01,year,,,For Profit,,,,,"Hardware, Information Technology"
Epixel Blockchain,https://www.crunchbase.com/organization/epixel-blockchain,"Blockchain, Information Technology, Software","408,895",,,,,,,,,,,,,,,"Sheung Wan, Hong Kong Island, Hong Kong",,51-100,,,,,,,,,,,,,,,,,,,,,,,,,,,,,,,,,,,Private,,,,,,,,,,,,,,"438,775",,-0.3,-0.4,0,89,398.63,-67.35%,,,1,-52.34%,100%,43.92%,"32,910,016","10,187,679",44.84%,16,,,,,,,,,,,2009-08-19,day,,,For Profit,,,,,"Information Technology, Software"
Alefsys Limited,https://www.crunchbase.com/organization/alefsys-solutions,Information Technology,"409,740",,$1M to $10M,,,,,,,,,,,,,"Hong Kong, Hong Kong Island, Hong Kong",1,101-250,Anser Hussain Siddiqui,,,,,,,,,,,,,,,,,,,,,,,,,,,,,,,,,,Private,,,,,,,,,,,,,,"439,665",,-0.1,2.8,3,,,,,,,,,,,,,5,,,,,,,,,,,2009-01-01,year,,,For Profit,,,,,Information Technology
Ambieal,https://www.crunchbase.com/organization/ambieal,"Education, Information Technology, Training","409,962",,,,,,,,,,,,,,,"Sha Tin, New Territories, Hong Kong",2,1-10,"Belle Ho, Jacqueline Pan",,,,,,,,,,,,,,,,,,,,,,,,,,,,,,,,,,Private,,,,,,,,,,,,,,"439,902",,-0.3,-0.7,3.9,52,119.9,-63.2%,358,-26.4%,10,130.14%,,,"28,912,232","5,391,611",22.92%,13,,,,,,,,,,,2018-01-01,year,,,Non-profit,,,,,"Education, Information Technology"
