ENQ Enecuum,https://www.crunchbase.com/organization/enq-enecuum,"Blockchain, Cryptocurrency, Information Technology","235,036",,,,,,,,,,,,,,,"Hong Kong, Hong Kong Island, Hong Kong",2,,"Ivan V. Ivanov, Mikhail Sayfullin",,,,,,,,,,,,,,,,,,,,,,,,,,,,,,,,,,Private,,,,,,,,,,,,,,"253,575",,-0.1,-0.3,7.4,"2,453","2,219.09",127.14%,298,-45.44%,2.15,-8.89%,60.75%,-0.66%,,,,33,,,,,,,,,,,2017-01-01,year,,,For Profit,,,,,"Financial Services, Information Technology, Payments, Software"
FAS | Fintech Advisory Services,https://www.crunchbase.com/organization/fas-fintech-advisory-services,"Blockchain, Consulting, Information Technology, Payments","235,532",,,,,,,,,,,,,,,"Hong Kong, Hong Kong Island, Hong Kong",1,1-10,Elena Obukhova,,,,,,,,,,,,,,,,,,,,,,,,,,,,,,,,,,Private,,,,,,,,,,,,,,"254,104",,-0.2,-0.4,-0.2,168,223.92,,,,1,,100%,,"28,818,891",,,10,,,,,,,,,,,2018-12-06,day,,,For Profit,,,,,"Financial Services, Information Technology, Payments"
Logflows,https://www.crunchbase.com/organization/logflows,"Information Services, Information Technology, Logistics, SaaS","236,626",,,,,,,,,,,,,,,"Hong Kong, Hong Kong Island, Hong Kong",3,11-50,"Dick Wong, Felix Wong, Li Chen",,,,,,,,,,,,,,,,,,,,,,,,,,,,,,,,,,Private,,,,,,,,,,,,,,"255,283",,1.2,2.2,7.3,307,"1,148.86",-16.47%,2,-89.59%,2,-43.97%,0%,-18.76%,"23,654,432","6,587,642",38.6%,9,,,11,,,,,,,,,,,,For Profit,,,,,"Information Technology, Software, Transportation"
Interactive Data,https://www.crunchbase.com/organization/interactive-data-2,"Analytics, Big Data, Financial Services, Information Technology","237,050",12,,,,,,,,,,,,,,"Hong Kong, Hong Kong Island, Hong Kong",,51-100,,,,,,,,,,,,,,,,,,,,,,,,,,,,,,,,,,,Private,,,,,,,,,,,,,,"255,745",,-0.4,-0.1,-0.4,,,,,,,,,,,,,7,,,,,,,,,,,2015-06-01,day,,,For Profit,,,,,"Data and Analytics, Financial Services, Information Technology"
Cpjobs.com,https://www.crunchbase.com/organization/cpjobs-com,"Information Technology, Recruiting","237,459",,$50M to $100M,,,,,,,,,,,,,"Hong Kong, Hong Kong Island, Hong Kong",,501-1000,,,,,,,,,,,,,,,,,,,,,,,,,,,,,,,,,,,Private,,,,,,,,,,,,,,"256,185",,-0.3,-0.2,-0.9,"770,356","697,733.94",12.84%,209,2.46%,4.06,-5.3%,36.84%,0%,"72,500","-2,475",-3.3%,46,16,"48,699",21,,,,,,,,1973-01-01,year,,,For Profit,,,,,"Information Technology, Professional Services"
WeCollect,https://www.crunchbase.com/organization/wecollect,"CRM, FinTech, Information Technology, Mobile","237,759",,$1M to $10M,,,,,,,,,,,,,"Hong Kong, Hong Kong Island, Hong Kong",,11-50,,,,,,,,,,,,,,,,,,,,,,,,,,,,,,,,,,,Private,,,,,,,,,,,,,2,"256,522",,0,-0.1,0.3,756,"1,799.64",-55.29%,,,1,0%,100%,0%,"16,034,819","5,622,566",54%,20,,,,,,,,,,,2014-01-01,year,,,For Profit,,,,,"Financial Services, Information Technology, Mobile, Sales and Marketing, Software"
Think Col,https://www.crunchbase.com/organization/think-col,"Consulting, Information Technology","238,459",,,,,,,,,,,,,,,"Causeway Bay, Hong Kong Island, Hong Kong",2,,"Kane Wu, Sam Ho",,,,,,,,,,,,,,,,,,,,,,,,,,,,,,,,,,Private,,,,,,,,,,,,,,"257,278",,0,2,6.1,221,287.49,-66.64%,18,-86.52%,2.57,-3.19%,32.34%,-22.93%,"21,946,356","7,828,246",55.45%,36,,,,,,,,,,,2016-01-01,day,,,For Profit,,,,,Information Technology
CommVerge Solutions,https://www.crunchbase.com/organization/commverge-solutions,"Information Technology, Telecommunications","238,859",,,,,,,,,,,,,,,"Hong Kong, Hong Kong Island, Hong Kong",,51-100,,,,,,,,,,,,,,,,,,,,,,,,,,,,,,,,,,,Private,,,,,,,,,,,,,,"257,711",,-0.1,-0.5,-0.3,"5,894","5,018.63",34.01%,100,-15.13%,2.95,-6.38%,52%,-0.63%,"3,352,222","-581,988",-14.79%,13,,,2,,,,,,,,1999-01-01,year,,,For Profit,,,,,"Hardware, Information Technology"
Beijing Enterprises Holding,https://www.crunchbase.com/organization/beijing-enterprises-holding,"Government, Information Technology","240,164",2,,,,,,,,,,,,,,"Wan Chai, Hong Kong Island, Hong Kong",,10001+,,,,,,IPO,,,,,,,,,,,,,,,,2,Made Acquisitions,,,,,,,,,,,,Public,2003-04-17,,,,,,,,,BJINY,https://www.crunchbase.com/ipo/beijing-enterprises-holding-ipo--6c984a38,OTC Pink,,"259,120",,0.1,1.7,0.8,"1,578","1,559.89",-34.33%,53,-39.4%,3.35,-17.62%,0%,-39.42%,"8,129,354","2,197,107",37.04%,3,,,1,,,,,,,,1997-01-01,year,2003-04-17,day,For Profit,,,,,"Government and Military, Information Technology"
eMALI.IO Limited,https://www.crunchbase.com/organization/emali-io-limited,Information Technology,"241,669",,,,,,,,,,,,,,,"Tai Po, New Territories, Hong Kong",,,,,,,,,,,,,,,,,,,,,,,,,,,,,,,,,,,,,Private,,,,,,,,,,,,,,"260,739",,0.1,3.6,4.6,,175.49,-100%,,,,,,,,,,16,,,,,,,,,,,2016-08-22,day,,,,,,,,Information Technology
CYPHER,https://www.crunchbase.com/organization/cypher-4285,"Cyber Security, Information Technology, Security","242,182",,,,,,,,,,,,,,,"Kowloon City, Kowloon, Hong Kong",,1-10,,,,,,,,,,,,,,,,,,,,,,,,,,,,,,,,,,,Private,,,,,,,,,,,,,,"261,297",,-0.4,-0.2,7.3,,146.63,-100%,,,,,,,,,,5,,,,,,,,,,,,,,,For Profit,,,,,"Information Technology, Privacy and Security"
eCOM,https://www.crunchbase.com/organization/ecom-2,"Automotive, Blockchain, Financial Services, Information Technology, Transportation","245,018",,Less than $1M,,,,,,,,,,,,,"Wan Chai, Hong Kong Island, Hong Kong",,51-100,,,,,,,,,,,,,,,,,,,,,,,,,,,,,,,,,,,Private,,,,,,,,,,,,,1,"264,349",,2,0.9,3.4,365,"8,286.62",-95.01%,287,"4,718.05%",2.79,82.5%,50.66%,48.11%,"17,386,941","13,379,256",333.84%,22,,,5,,,,,,,,1996-01-01,year,,,For Profit,,,,,"Financial Services, Information Technology, Transportation"
Wallem Group,https://www.crunchbase.com/organization/wallem-group,Information Technology,"245,256",,,,,,,,,,,,,,,"Quarry Bay, Hong Kong Island, Hong Kong",,501-1000,,,,,,,,,,,,,,,,,,,,,,,,,,,,,,,,,,,Private,,,,,,,,,,,,,,"264,610",,-0.4,-0.6,-0.6,"11,718","27,706.65",-53.02%,224,70.65%,4.27,91.39%,33.51%,-2.63%,"1,874,218","423,723",29.21%,45,1,,11,,,,,,,,1903-01-01,year,,,For Profit,,,,,Information Technology
Messer Financial Software,https://www.crunchbase.com/organization/messer-financial-software,"Finance, Information Technology, Software","246,091",,$1M to $10M,,,,,,,,,,,,,"Hong Kong, Hong Kong Island, Hong Kong",,11-50,,,,,,,,,,,,,,,,,,,,,,,,,,,,,,,,,,,Private,,,,,,,,,,,,,,"265,523",,0.2,-0.3,-0.4,113,55.29,-13.61%,107,285.45%,3,0%,,,"27,458,663","1,369,898",5.25%,30,,,,,,,,,,,2013-01-01,year,,,For Profit,,,,,"Financial Services, Information Technology, Software"
Chayora,https://www.crunchbase.com/organization/chayora,Information Technology,"246,825",,,,,,,,,,,,,,,"Central, Hong Kong Island, Hong Kong",,11-50,,,,,,,,,,,,,,,,,,,,,,,,,,,,,,,,,,,Private,,,,,,,,,,,,,2,"266,320",,-0.4,0,-0.1,430,420.38,13.16%,48,6.66%,2.37,-19.94%,49.13%,49.13%,"16,780,948","-47,418",-0.28%,4,,,,,,,,,,,2011-01-01,year,,,For Profit,,,,,Information Technology
Trace Labs,https://www.crunchbase.com/organization/trace-labs,"Blockchain, Data Integration, Information Technology, Software","251,537",,,,,,,,,,,,,,,"Hong Kong, Hong Kong Island, Hong Kong",3,11-50,"Branimir Rakic, Tomaz Levak, Ziga Drev",,,,,,,,,,,,,,,,,,,,,,,,,,,,,,,,,,Private,,,,,,,,,,,,,,"271,372",,-0.4,-0.1,7.2,237,181.13,-51.94%,,,1,-38.08%,100%,20.5%,"25,651,331","8,506,317",49.61%,22,,,,,,,,,,,2018-01-01,year,,,For Profit,,,,,"Data and Analytics, Information Technology, Software"
Systex,https://www.crunchbase.com/organization/systex,Information Technology,"251,578",,,,,,,,,,,,,,,"Wan Chai, Hong Kong Island, Hong Kong",,,,,,,,,,,,,,,,,,,,,,,,,,,,,,,,,,,,,Private,,,,,,,,,,,,,,"271,415",,0.2,0.5,0.8,"15,586","4,992.27",382.63%,316,"43,229.44%",2.73,67.44%,42.19%,-18.58%,"2,274,185","-5,324,700",-70.07%,8,,,2,,,,,,,,1997-01-01,year,,,For Profit,,,,,Information Technology
Appcider Limited,https://www.crunchbase.com/organization/appcider-limited,"CRM, E-Commerce, Information Technology, Mobile, Transportation","253,054",,,,,,,,,,,,,,,"Hong Kong, Hong Kong Island, Hong Kong",,1-10,,,,,,,,,,,,,,,,,,,,,,,,,,,,,,,,,,,Private,,,,,,,,,,,,,1,"272,997",,-0.5,-0.5,1.7,511,527.37,25.61%,460,25.95%,13.08,32.62%,13.82%,1.91%,"10,495,869","-1,568,082",-13%,21,,,,,,,,,,,2016-03-04,day,,,For Profit,,,,,"Commerce and Shopping, Information Technology, Mobile, Sales and Marketing, Software, Transportation"
Okoone,https://www.crunchbase.com/organization/okoone,"CRM, Information Technology, Internet, iOS, Mobile","253,441",,$1M to $10M,,,,,,,,,,,,,"Central, Hong Kong Island, Hong Kong",1,11-50,Julien Meunier,,,,,,,,,,,,,,,,,,,,,,,,,,,,,,,,,,Private,,,,,,,,,,,,,,"273,416",,0.3,1.7,1.7,229,220.88,-34.65%,80,,3.19,219.13%,0%,-100%,"20,737,376","-1,352,901",-6.12%,28,,,8,,,,,,,,2014-09-15,day,,,For Profit,,,,,"Information Technology, Internet Services, Mobile, Platforms, Sales and Marketing, Software"
Trumptech,https://www.crunchbase.com/organization/trumptech,"Education, Information Technology","255,435",,,,,,,,,,,,,,,"Kowloon City, Kowloon, Hong Kong",,,,,,,,,,,,,,,,,,,,,,,,,,,,,,,,,,,,,Private,,,,,,,,,,,,,,"275,559",,-0.3,1,1.7,"1,818","1,226.79",472.61%,162,567.28%,7.87,-34.14%,43.49%,43.49%,"6,194,268","-6,885,262",-52.64%,31,,,,,,,,,,,,,,,,,,,,"Education, Information Technology"
m2Wealth,https://www.crunchbase.com/organization/m2wealth,"Information Technology, Software","257,399",,,,,,,,,,,,,,,"Hong Kong, Hong Kong Island, Hong Kong",3,,"Brent Fraser, Henry Kortt, Paul Graham",,,,,,,,,,,,,,,,,,,,,,,,,,,,,,,,,,Private,,,,,,,,,,,,,,"277,647",,0,-0.1,-0.7,604,287.91,69.33%,23,-86.82%,1.68,-56.2%,39.1%,39.1%,"17,935,160","1,590,081",9.73%,25,1,,6,,,,,,,,2001-01-01,year,,,,,,,,"Information Technology, Software"
TopDoc,https://www.crunchbase.com/organization/christelle-ho,"Health Care, Information Technology, Medical","258,249",,$1M to $10M,,,,,,,,,,,,,"Hong Kong, Hong Kong Island, Hong Kong",,1-10,,,,,,,,,,,,,,,,,,,,,,,,,,,,,,,,,,,Private,,,,,,,,,,,,,,"278,565",,-0.5,-0.7,-0.8,"14,604","37,988.22",-20.06%,176,105.15%,1.99,7.38%,57.79%,-15.3%,"2,214,730","294,939",15.36%,32,1,,7,,,,,,,,2013-06-01,day,,,For Profit,,,,,"Health Care, Information Technology"
Squared-S Artificial Intelligence,https://www.crunchbase.com/organization/squared-s-artificial-intelligence,"Artificial Intelligence, Big Data, CRM, Information Technology, Machine Learning","259,151",,,,,,,,,,,,,,,"Hong Kong, Hong Kong Island, Hong Kong",2,1-10,"Seth Huang, Soujit Ghosh",,,,,,,,,,,,,,,,,,,,,,,,,,,,,,,,,,Private,,,,,,,,,,,,,1,"279,543",,-0.5,-0.7,-0.8,143,97.1,,109,,6,,,,"22,040,627",,,7,,,,,,,,,,,2017-12-10,day,,,For Profit,,,,,"Artificial Intelligence, Data and Analytics, Information Technology, Sales and Marketing, Science and Engineering, Software"
MemoryX Blockchain Ltd.,https://www.crunchbase.com/organization/memoryx-blockchain-ltd,Information Technology,"260,889",,,,,,,,,,,,,,,"Mong Kok, Kowloon, Hong Kong",,1-10,,,,,,M&A,,,,,,,,,,,,,,,,,Was Acquired,MemoryX Blockchain Ltd. acquired by Diginex,https://www.crunchbase.com/acquisition/diginex-acquires-memoryx-blockchain-ltd--64623f29,Diginex,https://www.crunchbase.com/organization/diginex,2017-08-01,month,,,,Acquihire,,Private,,,,,,,,,,,,,,"281,400",,-0.1,-0.3,0,,,,,,,,,,,,,8,,,,,,,,,,,2016-11-11,day,2017-08-01,month,For Profit,,,,,Information Technology
VishareTech,https://www.crunchbase.com/organization/visharetech,"Information Technology, Software, Video","261,187",,,,,,,,,,,,,,,"Sha Tin, New Territories, Hong Kong",,,,,,,,,,,,,,,,,,,,,,,,,,,,,,,,,,,,,Private,,,,,,,,,,,,,1,"281,725",,-0.4,5.2,5.4,92,679.28,-18.07%,44,-98.01%,1.56,-74.05%,72.16%,72.16%,"31,774,936","7,498,263",30.89%,24,,,,,,,,,,,2012-01-01,year,,,,,,,,"Information Technology, Media and Entertainment, Software, Video"
Hong Kong Computer Society,https://www.crunchbase.com/organization/hong-kong-computer-society,Information Technology,"262,645",,,,,,,,,,,,,,,"Kwun Tong, Kowloon, Hong Kong",,,,,,,,,,,,,,,,,,,,,,,,,,,,,,,,,,,,,Private,,,,,,,,,,,,,,"283,278",,3.5,7,7,"3,597","3,484.96",11%,99,30.51%,3.93,11.25%,46.01%,19.82%,"4,489,268","-517,061",-10.33%,34,,,,,,,,,,,1970-01-01,year,,,For Profit,,,,,Information Technology
Holistic Technology,https://www.crunchbase.com/organization/holistic-technology,"E-Commerce, Information Technology, SaaS","265,379",,,,,,,,,,,,,,,"Hong Kong, Hong Kong Island, Hong Kong",,11-50,,,,,,,,,,,,,,,,,,,,,,,,,,,,,,,,,,,Private,,,,,,,,,,,,,1,"286,182",,-0.6,-0.4,0.3,658,773.22,-22.81%,176,"1,563.06%",3.36,67.99%,43.55%,43.55%,"12,507,999","-2,450,021",-16.38%,30,,,,,,,,,,,2012-05-07,day,,,For Profit,,,,,"Commerce and Shopping, Information Technology, Software"
Sharkboard,https://www.crunchbase.com/organization/sharkboard,"Information Services, Information Technology, Internet, Software","267,167",,,,,,,,,,,,,,,"Hong Kong, Hong Kong Island, Hong Kong",1,1-10,Markus Stefanko,,,,,,,,,,,,,,,,,,,,,,,,,,,,,,,,,,Private,,,,,,,,,,,,,,"288,107",,0,2.8,-0.2,101,54.46,,494,,2,,,,"30,290,309",,,13,,,2,,,,,,,,2014-01-01,year,,,For Profit,,,,,"Information Technology, Internet Services, Software"
Picowork Ltd.,https://www.crunchbase.com/organization/picowork-ltd,Information Technology,"267,228",,,,,,,,,,,,,,,"Cyberport, Hong Kong Island, Hong Kong",,51-100,,,,,,,,,,,,,,,,,,,,,,,,,,,,,,,,,,,Private,,,,,,,,,,,,,,"288,171",,0.6,-0.3,-0.6,161,"1,223.04",-95.17%,148,"4,881.11%",7.18,517.13%,55.01%,23.49%,"20,267,630","12,243,029",152.57%,16,15,,,,,,,,,,2010-07-25,day,,,For Profit,,,,,Information Technology
Hummingbird,https://www.crunchbase.com/organization/hummingbird-a978,"Analytics, Big Data, Information Technology","268,696",,,,,,,,,,,,,,,"Wan Chai, Hong Kong Island, Hong Kong",,,,,,,,,,,,,,,,,,,,,,,,,,,,,,,,,,,,,Private,,,,,,,,,,,,,1,"289,758",,0.2,6.9,7,112,37.95,-2.6%,512,140.44%,5,150%,,,"25,139,473","-3,975,146",-13.65%,23,,,,,,,,,,,,,,,For Profit,,,,,"Data and Analytics, Information Technology"
VPS Hosting,https://www.crunchbase.com/organization/asia-web-services,"Cloud Storage, Information Technology, SaaS, Security, Web Hosting","271,164",,Less than $1M,,,,,,,,,,,,,"Kowloon City, Kowloon, Hong Kong",,11-50,,,,,,,,,,,,,,,,,,,,,,,,,,,,,,,,,,,Private,,,,,,,,,,,,,,"292,355",,-0.3,-0.3,4.8,"2,462","3,373.34",17.67%,87,-21.18%,1.98,-36.93%,53.72%,-3.39%,"7,520,428","780,331",11.58%,41,,,10,,,,,,,,2007-06-07,day,,,For Profit,,,,,"Information Technology, Internet Services, Privacy and Security, Software"
Vizualize,https://www.crunchbase.com/organization/vizualize,"Analytics, Information Technology, Internet, Software","271,221",,$1M to $10M,,,,,,,,,,,,,"Central, Hong Kong Island, Hong Kong",1,11-50,Michael MacMillan,,,,,,,,,,,,,,,,,,,,,,,,,,,,,,,,,,Private,,,,,,,,,,,,,,"292,413",,-0.5,-0.4,-0.4,35,183.48,-87.63%,8,,2,100%,0%,-100%,"34,601,542","10,744,680",45.04%,29,,,10,,,,,,,,2004-01-01,year,,,For Profit,,,,,"Data and Analytics, Information Technology, Internet Services, Software"
Tetra Inspection,https://www.crunchbase.com/organization/tetra-inspection,"Information Technology, Logistics, Manufacturing, Quality Assurance, Service Industry, Supply Chain Management","273,417",,,,,,,,,,,,,,,"Hong Kong, Hong Kong Island, Hong Kong",1,11-50,Mohamed Afilal,,,,,,,,,,,,,,,,,,,,,,,,,,,,,,,,,,Private,,,,,,,,,,,,,,"294,764",,0.3,3.4,6.9,472,373.96,-11.23%,434,,3.61,261.33%,12.48%,-87.52%,"15,743,308","-2,692,741",-14.61%,29,,,,,,,,,,,2018-01-01,day,,,For Profit,,,,,"Information Technology, Manufacturing, Transportation"
RTI Holdings,https://www.crunchbase.com/organization/rti-holdings,"Information Technology, Manufacturing","275,132",,,,,,,,,,,,,,,"Hong Kong, Hong Kong Island, Hong Kong",,,,,,,,M&A,,,,,,,,,,,,,,,,,Was Acquired,RTI Holdings acquired by Avnet,https://www.crunchbase.com/acquisition/avnet-acquires-rti-holdings--6d69f172,Avnet,https://www.crunchbase.com/organization/avnet,2013-03-20,day,,,,,,Private,,,,,,,,,,,,,,"296,587",,-0.1,-0.5,-0.5,,,,,,,,,,,,,3,,,3,,,,,,,,1989-01-01,year,2013-03-20,day,,,,,,"Information Technology, Manufacturing"
NOVA InnoTech,https://www.crunchbase.com/organization/nova-innotech,"B2B, Banking, Consulting, Financial Services, Information Technology, Venture Capital","279,399",,,,,,,,,,,,,,,"Wan Chai, Hong Kong Island, Hong Kong",1,,Matthew Li,,,,,,,,,,,,,,,,,,,,,,,,,,,,,,,,,,Private,,,,,,,,,,,,,,"301,154",,2.4,-0.2,6.8,"3,270","2,547.91",73.23%,91,22.21%,2.08,-13.26%,32.38%,10.97%,"6,078,158","-2,117,240",-25.83%,21,,,,,,,,,,,,,,,For Profit,,,,,"Financial Services, Information Technology, Lending and Investments"
Dazzle,https://www.crunchbase.com/organization/dazzle,"Information Technology, Software, Web Development","280,593",,,,,,,,,,,,,,,"Kwun Tong, Kowloon, Hong Kong",1,1-10,Henry Yeung,,,,,,,,,,,,,,,,,,,,,,,,,,,,,,,,,,Private,,,,,,,,,,,,,,"302,441",,-0.4,-0.5,6.8,515,"12,792.52",-5.08%,47,8.39%,1.28,-23.9%,26.52%,26.52%,"20,268,386","2,285,001",12.71%,25,,,,,,,,,,,2015-01-01,year,,,For Profit,,,,,"Information Technology, Software"
AccessOrange,https://www.crunchbase.com/organization/accessorange,"Cloud Computing, Collaboration, Cyber Security, Information Technology","281,056",1,,,,,,,,,,,,,,"Hong Kong, Hong Kong Island, Hong Kong",,1-10,,,,,,,,,,,,,,,,,,,,,,,,,,,,,,,,,,,Private,,,,,,,,,,,,,,"302,938",,-0.3,3.4,-0.1,"4,815","16,497.2",101.16%,51,461.73%,1.54,1.95%,39.34%,-3.84%,"5,783,569","-3,000,242",-34.16%,50,,,20,,,,,,,,2016-04-29,day,,,For Profit,,,,,"Information Technology, Internet Services, Privacy and Security, Software"
Indemandly,https://www.crunchbase.com/organization/indemandly,"Information Technology, Marketing, Social Media Marketing, Software","281,767",,,,,,,,,,,,,,,"Wan Chai, Hong Kong Island, Hong Kong",,1-10,,,,,,,,,,,,,,,,,,,,,,,,,,,,,,,,,,,Private,,,,,,,,,,,,,,"303,694",,-0.4,0.1,6.8,375,992.37,49.73%,31,-85.3%,1.55,-57.66%,44.84%,-18.9%,"19,567,086","-65,596",-0.33%,26,,,,,,,,,,,2018-01-01,year,,,For Profit,,,,,"Information Technology, Sales and Marketing, Software"
EFA,https://www.crunchbase.com/organization/efa-30ab,"Consulting, Financial Services, Information Technology, Software","284,052",,$1M to $10M,,,,,,,,,,,,,"Sai Wan, Hong Kong Island, Hong Kong",2,11-50,"Iain Reed, Robin Hammond",,,,,,,,,,,,,,,,,,,,,,,,,,,,,,,,,,Private,,,,,,,,,,,,,,"306,112",,-0.4,0.3,-0.4,170,291.23,-53.45%,,,1,-73.6%,100%,100%,"28,660,182","12,456,893",76.88%,31,,,,,,,,,,,2003-01-01,year,,,For Profit,,,,,"Financial Services, Information Technology, Software"
Continuous Technologies,https://www.crunchbase.com/organization/continuous-technologies,"Enterprise, Information Technology, Software","286,223",,$10M to $50M,,,,,,,,,,,,,"North Point, Hong Kong Island, Hong Kong",,51-100,,,,,,,,,,,,,,,,,,,,,,,,,,,,,,,,,,,Private,,,,,,,,,,,,,,"308,437",,2.7,1.4,-0.3,232,134.53,147.23%,9,,1.83,82.72%,58.64%,-41.36%,"22,973,349","-9,961,237",-30.25%,17,,,,,,,,,,,1989-01-01,year,,,For Profit,,,,,"Information Technology, Software"
CitiPanda,https://www.crunchbase.com/organization/citipanda,Information Technology,"286,324",,,,,,,,,,,,,,,"Causeway Bay, Hong Kong Island, Hong Kong",,,,,,,,,,,,,,,,,,,,,,,,,,,,,,,,,,,,,Private,,,,,,,,,,,,,1,"308,544",,-0.4,-0.4,-0.6,56,57.69,,,,1,,100%,,"34,381,160",,,15,2,,,,,,,,,,2016-01-01,year,,,For Profit,,,,,Information Technology
Nextlink Technology,https://www.crunchbase.com/organization/nextlink-technology,"Consulting, Enterprise, Information Technology","286,432",,,,,,,,,,,,,,,"Causeway Bay, Hong Kong Island, Hong Kong",,,,,,,,,,,,,,,,,,,,,,,,,,,,,,,,,,,,,Private,,,,,,,,,,,,,,"308,657",,-0.3,0,0,146,"1,551.18",-49.13%,,,1,-9.17%,100%,10.1%,"30,100,976","6,718,605",28.73%,9,,,,,,,,,,,2006-01-01,year,,,For Profit,,,,,Information Technology
Foris,https://www.crunchbase.com/organization/foris,"Blockchain, Information Technology, Software","287,019",,,,,,,,,,,,,,,"Central, Hong Kong Island, Hong Kong",,1-10,,,,,,,,,,,,,,,,,,,,,,,,,,,,,,,,,,,Private,,,,,,,,,,,,,,"309,288",,-0.3,5.5,6.7,580,638.41,365.41%,48,-8.16%,2.51,25.64%,32.98%,32.98%,"14,346,521","-16,245,496",-53.1%,5,,,5,0,0,,Scientific and electric apparatus and instruments,,,,2016-01-01,year,,,For Profit,,,,,"Information Technology, Software"
SillyCube Technology,https://www.crunchbase.com/organization/silly-cube-technology-ltd,"E-Learning, Information Technology, Mobile, Software, Web Apps, Web Design","287,680",,Less than $1M,,,,,,,,,,,,,"Tsuen Wan, New Territories, Hong Kong",4,1-10,"Benny Chan, Billy Lo, Henry Hon, Lit Wai Kwong",,,,,,,,,,,,,,,,,,,,,,,,,,,,,,,,,,Private,,,,,,,,,,,,,,"309,988",,-0.3,-0.1,2.6,350,"1,647.72",-80.47%,47,-83.77%,1.14,-71.47%,86.3%,59.15%,"21,527,245","13,873,930",181.28%,28,,,12,,,,,,,,2009-01-01,year,,,,,,,,"Apps, Design, Education, Information Technology, Mobile, Software"
Aquis Search,https://www.crunchbase.com/organization/aquis-search,"Advice, Consulting, Information Technology, Legal, Legal Tech","289,273",,,,,,,,,,,,,,,"Central, Hong Kong Island, Hong Kong",,101-250,,,,,,,,,,,,,,,,,,,,,,,,,,,,,,,,,,,Private,,,,,,,,,,,,,,"311,721",,0.8,3.9,6.7,"12,223","13,878",-9.89%,92,0.98%,2.69,3.77%,38.8%,4.63%,"2,881,678","666,142",30.07%,41,,,24,,,,,,,,2009-01-01,year,,,For Profit,,,,,"Information Technology, Media and Entertainment, Professional Services"
SSEC Energy International,https://www.crunchbase.com/organization/ssec-energy-international,"Biotechnology, Information Technology, Internet of Things, Manufacturing","289,414",,,,,,,,,,,,,,,"Hong Kong, Hong Kong Island, Hong Kong",1,51-100,Min Tsai,,,,,,,,,,,,,,,,,,,,,,,,,,,,,,,,,,Private,,,,,,,,,,,,,,"311,871",,-0.3,-0.3,-0.2,,23.68,,,,,,,,,,,1,,,,,,,,,,,2014-09-10,day,,,For Profit,,,,,"Biotechnology, Information Technology, Internet Services, Manufacturing, Science and Engineering"
KT Group,https://www.crunchbase.com/organization/kt-group,"Blockchain, Information Services, Information Technology","290,472",2,$1M to $10M,,,,,,,,,,,,,"Kowloon City, Kowloon, Hong Kong",,,,,,,,,,,,,,,,,,,,,,,,,,,,,,,,,,,,,Private,,,,,,,,,,,,,,"312,989",,2.5,1.3,0.7,785,"1,427.14",,110,,3.05,,55.08%,,"11,711,745",,,12,,,,,,,,,,,2005-01-01,year,,,,,,,,Information Technology
CENSPOT TRADING CORPORATION LIMITED,https://www.crunchbase.com/organization/censpot-trading-corporation-limited,"Education, Government, Information Technology","296,368",,Less than $1M,,,,,,,,,,,,,"Hong Kong, Hong Kong Island, Hong Kong",,1-10,,,,,,,,,,,,,,,,,,,,,,,,,,,,,,,,,,,Private,,,,,,,,,,,,,,"319,254",,1.7,4.4,4.7,138,67.56,18.12%,146,-81.27%,4,0%,,,"24,239,767","-1,502,671",-5.84%,9,,,,,,,,,,,2014-10-01,month,,,,,,,,"Education, Government and Military, Information Technology"
OPTUS,https://www.crunchbase.com/organization/optus-2,"Analytics, Health Care, Information Technology, Internet, Software","296,868",5,Less than $1M,,,,,,,,,,,,,"Hong Kong, Hong Kong Island, Hong Kong",,,,1,,,,,2016-01-03,,,,Venture - Series Unknown,,,,Venture - Series Unknown,,,,Vertical.vc,,1,,,,,,,,,,,,,,Private,,,,,,,,,,,,,,"319,791",,0,0.8,1.1,,17.9,,,,,,,,,,,9,,,7,,,,,,,,,,,,For Profit,,,,,"Data and Analytics, Health Care, Information Technology, Internet Services, Software"
Bitrum,https://www.crunchbase.com/organization/bitrum-technology,"Information Technology, Internet of Things, Software","297,104",,,,,,,,,,,,,,,"Wan Chai, Hong Kong Island, Hong Kong",1,11-50,Loek Bosman,,,,,,,,,,,,,,,,,,,,,,,,,,,,,,,,,,Private,,,,,,,,,,,,,,"320,045",,1.5,-0.3,-0.5,,,,,,,,,,,,,2,,,10,,,,,,,,2012-12-31,day,,,For Profit,,,,,"Information Technology, Internet Services, Software"
AP Photonics,https://www.crunchbase.com/organization/ap-photonics,"Consumer Electronics, Electronics, Information Technology, Manufacturing","299,145",,,,,,,,,,,,,,,"Sha Tin, New Territories, Hong Kong",,,,,,,,,,,,,,,,,,,,,,,,,,,,,,,,,,,,,Private,,,,,,,,,,,,,2,"322,230",,0,-0.1,2.8,288,482.66,-53.39%,,,1,-85.71%,100%,100%,"23,880,247","11,375,853",90.97%,3,,,,,,,,,,,,,,,For Profit,,,,,"Consumer Electronics, Hardware, Information Technology, Manufacturing"
Litae,https://www.crunchbase.com/organization/litae,"Corporate Training, EdTech, Education, Human Resources, Information Technology, Internet","299,615",,,,,,,,,,,,,,,"Hong Kong, Hong Kong Island, Hong Kong",1,1-10,Jack Tsao,,,,,,,,,,,,,,,,,,,,,,,,,,,,,,,,,,Private,,,,,,,,,,,,,,"322,731",,-0.4,0,0.3,,16.84,,,,,,,,,,,5,,,,,,,,,,,2018-04-01,month,,,For Profit,,,,,"Education, Information Technology, Internet Services, Software"
Optica Technology,https://www.crunchbase.com/organization/optica-technology,"Hardware, Health Care, Information Technology, Robotics, Software","303,385",,,,,,,,,,,,,,,"Mong Kok, Kowloon, Hong Kong",,,,,,,,,,,,,,,,,,,,,,,,,,,,,,,,,,,,,Private,,,,,,,,,,,,,,"326,767",,-0.4,-0.4,-1,,,,,,,,,,,,,14,,,9,,,,,,,,2014-01-01,year,,,For Profit,,,,,"Hardware, Health Care, Information Technology, Science and Engineering, Software"
2Easy,https://www.crunchbase.com/organization/2easy,"Advertising, Information Technology, Marketing","305,188",,,,,,,,,,,,,,,"Cyberport, Hong Kong Island, Hong Kong",3,1-10,"Eddie Sin, Issac Neng, Wei Ping Teh",,,,,,,,,,,,,,,,,,,,,,,,,,,,,,,,,,Private,,,,,,,,,,,,,,"328,682",,-0.4,-0.7,5.7,"7,599","5,421.47",-6.16%,22,-47.6%,1.2,-45.11%,73.13%,13.03%,"4,254,824","1,006,766",31%,56,,,17,,,,,,,,2017-01-01,year,,,For Profit,,,,,"Advertising, Information Technology, Sales and Marketing"
Sportsync,https://www.crunchbase.com/organization/sportsync,"Information Services, Information Technology","306,363",,,,,,,,,,,,,,,"Hong Kong, Hong Kong Island, Hong Kong",1,11-50,Magnus Leung,,,,,,,,,,,,,,,,,,,,,,,,,,,,,,,,,,Private,,,,,,,,,,,,,,"329,942",,0.7,0.3,6.4,"4,170","1,783.02",42.71%,31,-52.24%,1.26,-14.85%,58.98%,-6.5%,"8,303,068","-2,431,210",-22.65%,14,,,,,,,,,,,2016-01-01,year,,,For Profit,,,,,Information Technology
PBC Consultants,https://www.crunchbase.com/organization/pbc-consultants,"Consulting, Financial Services, Information Technology, Legal, Mobile Payments, Payments","308,447",,,,,,,,,,,,,,,"Hong Kong, Hong Kong Island, Hong Kong",,11-50,,,,,,,,,,,,,,,,,,,,,,,,,,,,,,,,,,,Private,,,,,,,,,,,,,,"332,174",,0.4,-0.3,4,,253.33,,,,,,,,,,,19,,,,,,,,,,,1903-04-06,day,,,,,,,,"Financial Services, Information Technology, Mobile, Payments, Professional Services, Software"
